Title,PDF URL,DOI,Published Date,Primary Category,Entry ID,Citation Count,Paper ID
instructeval: towards holistic evaluation of instruction-tuned large language models,http://arxiv.org/pdf/2306.04757v3,,07/06/2023 21:12,cs.CL,http://arxiv.org/abs/2306.04757v3,0,2049
codesc: a large code-description parallel dataset,http://arxiv.org/pdf/2105.14220v1,,29/05/2021 06:40,cs.CL,http://arxiv.org/abs/2105.14220v1,0,2060
nxmtransformer: semi-structured sparsification for natural language understanding via admm,http://arxiv.org/pdf/2110.15766v1,,28/10/2021 18:43,cs.CL,http://arxiv.org/abs/2110.15766v1,0,2063
a pos tagger for code mixed indian social media text - icon-2016 nlp tools contest entry from surukam,http://arxiv.org/pdf/1701.00066v1,,31/12/2016 07:09,cs.CL,http://arxiv.org/abs/1701.00066v1,0,2082
"bangla word clustering based on tri-gram, 4-gram and 5-gram language model",http://arxiv.org/pdf/1701.08702v1,,27/01/2017 18:43,cs.CL,http://arxiv.org/abs/1701.08702v1,0,2083
back to the future -- sequential alignment of text representations,http://arxiv.org/pdf/1909.03464v3,,08/09/2019 14:35,cs.CL,http://arxiv.org/abs/1909.03464v3,0,2095
finetext: text classification via attention-based language model fine-tuning,http://arxiv.org/pdf/1910.11959v1,,26/10/2019 00:13,cs.CL,http://arxiv.org/abs/1910.11959v1,0,2101
learningword embeddings for low-resource languages by pu learning,http://arxiv.org/pdf/1805.03366v1,,09/05/2018 05:05,cs.CL,http://arxiv.org/abs/1805.03366v1,0,2106
embedding-enhanced giza++: improving alignment in low- and high- resource scenarios using embedding space geometry,http://arxiv.org/pdf/2104.08721v2,,18/04/2021 06:21,cs.CL,http://arxiv.org/abs/2104.08721v2,0,2119
electramed: a new pre-trained language representation model for biomedical nlp,http://arxiv.org/pdf/2104.09585v1,,19/04/2021 20:38,cs.CL,http://arxiv.org/abs/2104.09585v1,0,2120
extractive summary as discrete latent variables,http://arxiv.org/pdf/1811.05542v2,,14/11/2018 02:02,cs.CL,http://arxiv.org/abs/1811.05542v2,0,2124
pum at semeval-2020 task 12: aggregation of transformer-based models' features for offensive language recognition,http://arxiv.org/pdf/2010.01897v1,,05/10/2020 11:25,cs.CL,http://arxiv.org/abs/2010.01897v1,0,2135
improving sentiment analysis over non-english tweets using multilingual transformers and automatic translation for data-augmentation,http://arxiv.org/pdf/2010.03486v1,,07/10/2020 16:44,cs.CL,http://arxiv.org/abs/2010.03486v1,0,2137
multilingual contextual affective analysis of lgbt people portrayals in wikipedia,http://arxiv.org/pdf/2010.10820v2,,21/10/2020 09:27,cs.CL,http://arxiv.org/abs/2010.10820v2,0,2139
automatic difficulty classification of arabic sentences,http://arxiv.org/pdf/2103.04386v1,,07/03/2021 16:02,cs.CL,http://arxiv.org/abs/2103.04386v1,0,2152
penelopie: enabling open information extraction for the greek language through machine translation,http://arxiv.org/pdf/2103.15075v1,,28/03/2021 09:01,cs.CL,http://arxiv.org/abs/2103.15075v1,0,2154
xtremedistiltransformers: task transfer for task-agnostic distillation,http://arxiv.org/pdf/2106.04563v2,,08/06/2021 18:49,cs.CL,http://arxiv.org/abs/2106.04563v2,0,2157
don't rule out monolingual speakers: a method for crowdsourcing machine translation data,http://arxiv.org/pdf/2106.06875v1,,12/06/2021 23:29,cs.CL,http://arxiv.org/abs/2106.06875v1,0,2158
dacy: a unified framework for danish nlp,http://arxiv.org/pdf/2107.05295v1,,12/07/2021 11:14,cs.CL,http://arxiv.org/abs/2107.05295v1,0,2161
knowledge distillation from bert transformer to speech transformer for intent classification,http://arxiv.org/pdf/2108.02598v1,,05/08/2021 14:08,cs.CL,http://arxiv.org/abs/2108.02598v1,0,2163
on homophony and rnyi entropy,http://arxiv.org/pdf/2109.13766v1,,28/09/2021 15:41,cs.CL,http://arxiv.org/abs/2109.13766v1,0,2167
kobest: korean balanced evaluation of significant tasks,http://arxiv.org/pdf/2204.04541v1,,09/04/2022 21:13,cs.CL,http://arxiv.org/abs/2204.04541v1,0,2179
a new evaluation method: evaluation data and metrics for chinese grammar error correction,http://arxiv.org/pdf/2205.00217v1,,30/04/2022 10:40,cs.CL,http://arxiv.org/abs/2205.00217v1,0,2180
transformer-based model for word level language identification in code-mixed kannada-english texts,http://arxiv.org/pdf/2211.14459v1,,26/11/2022 02:39,cs.CL,http://arxiv.org/abs/2211.14459v1,0,2207
deep learning model for mongolian citizens feedback analysis using word vector embeddings,http://arxiv.org/pdf/2302.12069v1,,23/02/2023 14:49,cs.CL,http://arxiv.org/abs/2302.12069v1,0,2217
domain-specific continued pretraining of language models for capturing long context in mental health,http://arxiv.org/pdf/2304.10447v1,,20/04/2023 17:43,cs.CL,http://arxiv.org/abs/2304.10447v1,0,2225
understanding lexical biases when identifying gang-related social media communications,http://arxiv.org/pdf/2304.11485v1,,22/04/2023 22:51,cs.CL,http://arxiv.org/abs/2304.11485v1,0,2227
infor-coef: information bottleneck-based dynamic token downsampling for compact and efficient language model,http://arxiv.org/pdf/2305.12458v1,,21/05/2023 14:30,cs.CL,http://arxiv.org/abs/2305.12458v1,0,2232
farewell to aimless large-scale pretraining: influential subset selection for language model,http://arxiv.org/pdf/2305.12816v1,,22/05/2023 09:18,cs.CL,http://arxiv.org/abs/2305.12816v1,0,2234
let's think frame by frame: evaluating video chain of thought with video infilling and prediction,http://arxiv.org/pdf/2305.13903v1,,23/05/2023 11:26,cs.CL,http://arxiv.org/abs/2305.13903v1,0,2236
collie: systematic construction of constrained text generation tasks,http://arxiv.org/pdf/2307.08689v1,,17/07/2023 18:48,cs.CL,http://arxiv.org/abs/2307.08689v1,0,2242
a chart-parsing algorithm for efficient semantic analysis,http://arxiv.org/pdf/cs/0209002v1,,02/09/2002 17:55,cs.CL,http://arxiv.org/abs/cs/0209002v1,0,2266
lightweight transformers for clinical natural language processing,http://arxiv.org/pdf/2302.04725v1,,09/02/2023 16:07,cs.CL,http://arxiv.org/abs/2302.04725v1,0,2280
frasimed: a clinical french annotated resource produced through crosslingual bert-based annotation projection,http://arxiv.org/pdf/2309.10770v1,,19/09/2023 18:17,cs.CL,http://arxiv.org/abs/2309.10770v1,0,2285
multidimensional transformation-based learning,http://arxiv.org/pdf/cs/0107021v1,,17/07/2001 16:43,cs.CL,http://arxiv.org/abs/cs/0107021v1,0,2290
taylorgan: neighbor-augmented policy update for sample-efficient natural language generation,http://arxiv.org/pdf/2011.13527v1,,27/11/2020 02:26,cs.CL,http://arxiv.org/abs/2011.13527v1,0,2301
contrasting human- and machine-generated word-level adversarial examples for text classification,http://arxiv.org/pdf/2109.04385v1,,09/09/2021 17:16,cs.CL,http://arxiv.org/abs/2109.04385v1,0,2307
temporal relation extraction with a graph-based deep biaffine attention model,http://arxiv.org/pdf/2201.06125v1,,16/01/2022 19:40,cs.CL,http://arxiv.org/abs/2201.06125v1,0,2311
"when classifying grammatical role, bert doesn't care about word order... except when it matters",http://arxiv.org/pdf/2203.06204v1,,11/03/2022 19:00,cs.CL,http://arxiv.org/abs/2203.06204v1,0,2313
data-driven hr - rsum analysis based on natural language processing and machine learning,http://arxiv.org/pdf/1606.05611v2,,17/06/2016 18:52,cs.CL,http://arxiv.org/abs/1606.05611v2,0,2319
the interplay between lexical resources and natural language processing,http://arxiv.org/pdf/1807.00571v1,,02/07/2018 10:53,cs.CL,http://arxiv.org/abs/1807.00571v1,0,2322
"lpar -- a distributed multi agent platform for building polyglot, omni channel and industrial grade natural language interfaces",http://arxiv.org/pdf/2006.14666v1,,25/06/2020 20:20,cs.CL,http://arxiv.org/abs/2006.14666v1,0,2328
coaxing confidences from an old friend: probabilistic classifications from transformation rule lists,http://arxiv.org/pdf/cs/0104020v1,,28/04/2001 00:16,cs.CL,http://arxiv.org/abs/cs/0104020v1,0,2340
transformation-based learning in the fast lane,http://arxiv.org/pdf/cs/0107020v1,,17/07/2001 16:26,cs.CL,http://arxiv.org/abs/cs/0107020v1,0,2341
a method for open-vocabulary speech-driven text retrieval,http://arxiv.org/pdf/cs/0206014v1,,09/06/2002 11:07,cs.CL,http://arxiv.org/abs/cs/0206014v1,0,2342
summarizing reports on evolving events; part i: linear evolution,http://arxiv.org/pdf/cs/0508092v1,,22/08/2005 13:56,cs.CL,http://arxiv.org/abs/cs/0508092v1,0,2343
question answering in a natural language understanding system based on object-oriented semantics,http://arxiv.org/pdf/1111.4343v1,,18/11/2011 12:31,cs.CL,http://arxiv.org/abs/1111.4343v1,0,2346
recent technological advances in natural language processing and artificial intelligence,http://arxiv.org/pdf/1208.4079v1,,20/08/2012 19:34,cs.CL,http://arxiv.org/abs/1208.4079v1,0,2347
lightweight and efficient neural natural language processing with quaternion networks,http://arxiv.org/pdf/1906.04393v1,,11/06/2019 05:56,cs.CL,http://arxiv.org/abs/1906.04393v1,0,2361
aspect-based opinion extraction from customer reviews,http://arxiv.org/pdf/1404.1982v1,,08/04/2014 02:19,cs.CL,http://arxiv.org/abs/1404.1982v1,0,2369
equalizing gender biases in neural machine translation with word embeddings techniques,http://arxiv.org/pdf/1901.03116v2,,10/01/2019 12:06,cs.CL,http://arxiv.org/abs/1901.03116v2,0,2380
tensorized embedding layers for efficient model compression,http://arxiv.org/pdf/1901.10787v2,,30/01/2019 12:43,cs.CL,http://arxiv.org/abs/1901.10787v2,0,2381
"identification, interpretability, and bayesian word embeddings",http://arxiv.org/pdf/1904.01628v1,,02/04/2019 20:12,cs.CL,http://arxiv.org/abs/1904.01628v1,0,2386
processamento de linguagem natural em portugus e aprendizagem profunda para o domnio de leo e gs,http://arxiv.org/pdf/1908.01674v2,,05/08/2019 16:05,cs.CL,http://arxiv.org/abs/1908.01674v2,0,2389
combining axiom injection and knowledge base completion for efficient natural language inference,http://arxiv.org/pdf/1811.06203v1,,15/11/2018 06:40,cs.CL,http://arxiv.org/abs/1811.06203v1,0,2409
is artificial data useful for biomedical natural language processing algorithms?,http://arxiv.org/pdf/1907.01055v2,,01/07/2019 21:17,cs.CL,http://arxiv.org/abs/1907.01055v2,0,2411
neural unsupervised domain adaptation in nlp---a survey,http://arxiv.org/pdf/2006.00632v2,,31/05/2020 23:34,cs.CL,http://arxiv.org/abs/2006.00632v2,0,2417
extending the abstraction of personality types based on mbti with machine learning and natural language processing,http://arxiv.org/pdf/2105.11798v1,,25/05/2021 11:00,cs.CL,http://arxiv.org/abs/2105.11798v1,0,2440
the application of active query k-means in text classification,http://arxiv.org/pdf/2107.07682v1,,16/07/2021 04:06,cs.CL,http://arxiv.org/abs/2107.07682v1,0,2443
don't search for a search method -- simple heuristics suffice for adversarial text attacks,http://arxiv.org/pdf/2109.07926v2,,16/09/2021 13:22,cs.CL,http://arxiv.org/abs/2109.07926v2,0,2445
open-domain clarification question generation without question examples,http://arxiv.org/pdf/2110.09779v1,,19/10/2021 08:51,cs.CL,http://arxiv.org/abs/2110.09779v1,0,2450
turkish sentiment analysis using machine learning methods: application on online food order site reviews,http://arxiv.org/pdf/2201.03848v1,,11/01/2022 09:13,cs.CL,http://arxiv.org/abs/2201.03848v1,0,2453
tsm: measuring the enticement of honeyfiles with natural language processing,http://arxiv.org/pdf/2203.07580v1,,15/03/2022 01:07,cs.CL,http://arxiv.org/abs/2203.07580v1,0,2455
classification of natural language processing techniques for requirements engineering,http://arxiv.org/pdf/2204.04282v1,,08/04/2022 21:28,cs.CL,http://arxiv.org/abs/2204.04282v1,0,2459
sentiment analysis with r: natural language processing for semi-automated assessments of qualitative data,http://arxiv.org/pdf/2206.12649v1,,25/06/2022 14:25,cs.CL,http://arxiv.org/abs/2206.12649v1,0,2468
enhancements to the boun treebank reflecting the agglutinative nature of turkish,http://arxiv.org/pdf/2207.11782v1,,24/07/2022 18:56,cs.CL,http://arxiv.org/abs/2207.11782v1,0,2469
combating high variance in data-scarce implicit hate speech classification,http://arxiv.org/pdf/2208.13595v1,,29/08/2022 14:45,cs.CL,http://arxiv.org/abs/2208.13595v1,0,2474
dyrex: dynamic query representation for extractive question answering,http://arxiv.org/pdf/2210.15048v1,,26/10/2022 22:26,cs.CL,http://arxiv.org/abs/2210.15048v1,0,2479
a critical reflection and forward perspective on empathy and natural language processing,http://arxiv.org/pdf/2210.16604v1,,29/10/2022 14:57,cs.CL,http://arxiv.org/abs/2210.16604v1,0,2480
"discover, explanation, improvement: an automatic slice detection framework for natural language processing",http://arxiv.org/pdf/2211.04476v2,,08/11/2022 19:00,cs.CL,http://arxiv.org/abs/2211.04476v2,0,2481
sta: self-controlled text augmentation for improving text classifications,http://arxiv.org/pdf/2302.12784v1,,24/02/2023 17:54,cs.CL,http://arxiv.org/abs/2302.12784v1,0,2489
self-improving-leaderboard(sil): a call for real-world centric natural language processing leaderboards,http://arxiv.org/pdf/2303.10888v1,,20/03/2023 06:13,cs.CL,http://arxiv.org/abs/2303.10888v1,0,2491
convolutional neural networks for sentiment analysis on weibo data: a natural language processing approach,http://arxiv.org/pdf/2307.06540v1,,13/07/2023 04:02,cs.CL,http://arxiv.org/abs/2307.06540v1,0,2504
climatenlp: analyzing public sentiment towards climate change using natural language processing,http://arxiv.org/pdf/2310.08099v1,,12/10/2023 08:48,cs.CL,http://arxiv.org/abs/2310.08099v1,0,2510
nlnde: the neither-language-nor-domain-experts' way of spanish medical document de-identification,http://arxiv.org/pdf/2007.01030v1,,02/07/2020 12:30,cs.CL,http://arxiv.org/abs/2007.01030v1,0,2530
end-to-end spoken language understanding using transformer networks and self-supervised pre-trained features,http://arxiv.org/pdf/2011.08238v1,,16/11/2020 19:30,cs.CL,http://arxiv.org/abs/2011.08238v1,0,2531
application of lexical features towards improvement of filipino readability identification of children's literature,http://arxiv.org/pdf/2101.10537v1,,22/01/2021 19:54,cs.CL,http://arxiv.org/abs/2101.10537v1,0,2534
a dataset of kurdish (sorani) named entities -- an amendment to kurdish-blark named entities,http://arxiv.org/pdf/2301.04962v1,,12/01/2023 12:13,cs.CL,http://arxiv.org/abs/2301.04962v1,0,2551
connecting large language models with evolutionary algorithms yields powerful prompt optimizers,http://arxiv.org/pdf/2309.08532v1,,15/09/2023 17:50,cs.CL,http://arxiv.org/abs/2309.08532v1,0,2579
efficient transformer-based large scale language representations using hardware-friendly block structured pruning,http://arxiv.org/pdf/2009.08065v4,,17/09/2020 05:45,cs.CL,http://arxiv.org/abs/2009.08065v4,0,2587
dpcspell: a transformer-based detector-purificator-corrector framework for spelling error correction of bangla and resource scarce indic languages,http://arxiv.org/pdf/2211.03730v1,,07/11/2022 17:59,cs.CL,http://arxiv.org/abs/2211.03730v1,0,2597
toward efficient language model pretraining and downstream adaptation via self-evolution: a case study on superglue,http://arxiv.org/pdf/2212.01853v1,,04/12/2022 15:36,cs.CL,http://arxiv.org/abs/2212.01853v1,0,2600
"colexifications for bootstrapping cross-lingual datasets: the case of phonology, concreteness, and affectiveness",http://arxiv.org/pdf/2306.02646v1,,05/06/2023 08:32,cs.CL,http://arxiv.org/abs/2306.02646v1,0,2607
factllama: optimizing instruction-following language models with external knowledge for automated fact-checking,http://arxiv.org/pdf/2309.00240v1,,01/09/2023 05:14,cs.CL,http://arxiv.org/abs/2309.00240v1,0,2612
towards structural natural language formalization: mapping discourse to controlled natural language,http://arxiv.org/pdf/1312.2087v1,,07/12/2013 11:19,cs.CL,http://arxiv.org/abs/1312.2087v1,0,2616
sense2vec - a fast and accurate method for word sense disambiguation in neural word embeddings,http://arxiv.org/pdf/1511.06388v1,,19/11/2015 21:22,cs.CL,http://arxiv.org/abs/1511.06388v1,0,2676
rare disease identification from clinical notes with ontologies and weak supervision,http://arxiv.org/pdf/2105.01995v3,,05/05/2021 12:49,cs.CL,http://arxiv.org/abs/2105.01995v3,0,2683
"causal transformers perform below chance on recursive nested constructions, unlike humans",http://arxiv.org/pdf/2110.07240v1,,14/10/2021 10:22,cs.CL,http://arxiv.org/abs/2110.07240v1,0,2686
short text pre-training with extended token classification for e-commerce query understanding,http://arxiv.org/pdf/2210.03915v1,,08/10/2022 05:50,cs.CL,http://arxiv.org/abs/2210.03915v1,0,2689
a distributed automatic domain-specific multi-word term recognition architecture using spark ecosystem,http://arxiv.org/pdf/2305.16343v1,,24/05/2023 11:05,cs.CL,http://arxiv.org/abs/2305.16343v1,0,2694
a differentiable language model adversarial attack on text classifiers,http://arxiv.org/pdf/2107.11275v1,,23/07/2021 15:43,cs.CL,http://arxiv.org/abs/2107.11275v1,0,2722
utilizing background knowledge for robust reasoning over traffic situations,http://arxiv.org/pdf/2212.07798v1,,04/12/2022 09:17,cs.CL,http://arxiv.org/abs/2212.07798v1,0,2729
text2kgbench: a benchmark for ontology-driven knowledge graph generation from text,http://arxiv.org/pdf/2308.02357v1,,04/08/2023 15:47,cs.CL,http://arxiv.org/abs/2308.02357v1,0,2736
detecting sub-topic correspondence through bipartite term clustering,http://arxiv.org/pdf/cs/9908001v1,,01/08/1999 15:02,cs.CL,http://arxiv.org/abs/cs/9908001v1,0,2751
comparing two trainable grammatical relations finders,http://arxiv.org/pdf/cs/0008004v1,,08/08/2000 23:42,cs.CL,http://arxiv.org/abs/cs/0008004v1,0,2753
more accurate tests for the statistical significance of result differences,http://arxiv.org/pdf/cs/0008005v1,,09/08/2000 00:52,cs.CL,http://arxiv.org/abs/cs/0008005v1,0,2754
using existing systems to supplement small amounts of annotated grammatical relations training data,http://arxiv.org/pdf/cs/0010020v1,,11/10/2000 23:30,cs.CL,http://arxiv.org/abs/cs/0010020v1,0,2757
computational properties of environment-based disambiguation,http://arxiv.org/pdf/cs/0106011v1,,07/06/2001 16:47,cs.CL,http://arxiv.org/abs/cs/0106011v1,0,2758
integrating multiple knowledge sources for robust semantic parsing,http://arxiv.org/pdf/cs/0109023v1,,17/09/2001 15:41,cs.CL,http://arxiv.org/abs/cs/0109023v1,0,2760
scaling construction grammar up to production systems: the scim,http://arxiv.org/pdf/cs/0611069v1,,15/11/2006 12:35,cs.CL,http://arxiv.org/abs/cs/0611069v1,0,2763
ludics and its applications to natural language semantics,http://arxiv.org/pdf/0910.1484v1,,08/10/2009 13:21,cs.CL,http://arxiv.org/abs/0910.1484v1,0,2764
construction du lexique lglex  partir des tables du lexique-grammaire des verbes du grec moderne,http://arxiv.org/pdf/1111.3153v1,,14/11/2011 09:34,cs.CL,http://arxiv.org/abs/1111.3153v1,0,2767
robustly leveraging prior knowledge in text classification,http://arxiv.org/pdf/1503.00841v1,,03/03/2015 06:59,cs.CL,http://arxiv.org/abs/1503.00841v1,0,2773
a framework for comparing groups of documents,http://arxiv.org/pdf/1508.05902v1,,24/08/2015 19:14,cs.CL,http://arxiv.org/abs/1508.05902v1,0,2777
building memory with concept learning capabilities from large-scale knowledge base,http://arxiv.org/pdf/1512.01173v1,,03/12/2015 17:52,cs.CL,http://arxiv.org/abs/1512.01173v1,0,2780
efficient parallel learning of word2vec,http://arxiv.org/pdf/1606.07822v1,,24/06/2016 21:05,cs.CL,http://arxiv.org/abs/1606.07822v1,0,2783
improving historical spelling normalization with bi-directional lstms and multi-task learning,http://arxiv.org/pdf/1610.07844v1,,25/10/2016 13:30,cs.CL,http://arxiv.org/abs/1610.07844v1,0,2788
de-identification in practice,http://arxiv.org/pdf/1701.03129v1,,11/01/2017 19:22,cs.CL,http://arxiv.org/abs/1701.03129v1,0,2791
be precise or fuzzy: learning the meaning of cardinals and quantifiers from vision,http://arxiv.org/pdf/1702.05270v1,,17/02/2017 09:26,cs.CL,http://arxiv.org/abs/1702.05270v1,0,2792
why we have switched from building full-fledged taxonomies to simply detecting hypernymy relations,http://arxiv.org/pdf/1703.04178v2,,12/03/2017 21:07,cs.CL,http://arxiv.org/abs/1703.04178v2,0,2793
joint learning of correlated sequence labelling tasks using bidirectional recurrent neural networks,http://arxiv.org/pdf/1703.04650v3,,14/03/2017 18:26,cs.CL,http://arxiv.org/abs/1703.04650v3,0,2794
leveraging sparse and dense feature combinations for sentiment classification,http://arxiv.org/pdf/1708.03940v1,,13/08/2017 18:38,cs.CL,http://arxiv.org/abs/1708.03940v1,0,2799
sentiment classification using images and label embeddings,http://arxiv.org/pdf/1712.00725v1,,03/12/2017 07:20,cs.CL,http://arxiv.org/abs/1712.00725v1,0,2802
efficiency through auto-sizing: notre dame nlp's submission to the wngt efficiency task,http://arxiv.org/pdf/1910.07134v1,,16/10/2019 03:22,cs.CL,http://arxiv.org/abs/1910.07134v1,0,2815
transfer and multi-task learning for noun-noun compound interpretation,http://arxiv.org/pdf/1809.06748v1,,18/09/2018 15:01,cs.CL,http://arxiv.org/abs/1809.06748v1,0,2837
deep learning embeddings for discontinuous linguistic units,http://arxiv.org/pdf/1312.5129v2,,18/12/2013 13:34,cs.CL,http://arxiv.org/abs/1312.5129v2,0,2839
neural vector conceptualization for word vector space interpretation,http://arxiv.org/pdf/1904.01500v1,,02/04/2019 16:39,cs.CL,http://arxiv.org/abs/1904.01500v1,0,2840
a survey on why-type question answering systems,http://arxiv.org/pdf/1911.04879v1,,12/11/2019 14:25,cs.CL,http://arxiv.org/abs/1911.04879v1,0,2847
duth at semeval-2020 task 11: bert with entity mapping for propaganda classification,http://arxiv.org/pdf/2008.09894v2,,22/08/2020 19:18,cs.CL,http://arxiv.org/abs/2008.09894v2,0,2858
adversarial multi-binary neural network for multi-class classification,http://arxiv.org/pdf/2003.11184v1,,25/03/2020 02:19,cs.CL,http://arxiv.org/abs/2003.11184v1,0,2874
recent trends in the use of deep learning models for grammar error handling,http://arxiv.org/pdf/2009.02358v1,,04/09/2020 19:50,cs.CL,http://arxiv.org/abs/2009.02358v1,0,2876
langsmith: an interactive academic text revision system,http://arxiv.org/pdf/2010.04332v1,,09/10/2020 03:35,cs.CL,http://arxiv.org/abs/2010.04332v1,0,2878
an analysis of simple data augmentation for named entity recognition,http://arxiv.org/pdf/2010.11683v1,,22/10/2020 14:21,cs.CL,http://arxiv.org/abs/2010.11683v1,0,2879
domain-transferable method for named entity recognition task,http://arxiv.org/pdf/2011.12170v1,,24/11/2020 15:45,cs.CL,http://arxiv.org/abs/2011.12170v1,0,2882
from syntactic structure to semantic relationship: hypernym extraction from definitions by recurrent neural networks using the part of speech information,http://arxiv.org/pdf/2012.03418v1,,07/12/2020 02:18,cs.CL,http://arxiv.org/abs/2012.03418v1,0,2884
meistermorxrc at semeval-2020 task 9: fine-tune bert and multitask learning for sentiment analysis of code-mixed tweets,http://arxiv.org/pdf/2101.03028v1,,15/12/2020 10:42,cs.CL,http://arxiv.org/abs/2101.03028v1,0,2886
adapting marbert for improved arabic dialect identification: submission to the nadi shared task,http://arxiv.org/pdf/2103.01065v1,,01/03/2021 15:19,cs.CL,http://arxiv.org/abs/2103.01065v1,0,2893
"architectures of meaning, a systematic corpus analysis of nlp systems",http://arxiv.org/pdf/2107.08124v1,,16/07/2021 22:10,cs.CL,http://arxiv.org/abs/2107.08124v1,0,2897
"document ai: benchmarks, models and applications",http://arxiv.org/pdf/2111.08609v1,,16/11/2021 16:43,cs.CL,http://arxiv.org/abs/2111.08609v1,0,2906
state of the art in artificial intelligence applied to the legal domain,http://arxiv.org/pdf/2204.07047v1,,10/03/2022 16:20,cs.CL,http://arxiv.org/abs/2204.07047v1,0,2917
who is we? disambiguating the referents of first person plural pronouns in parliamentary debates,http://arxiv.org/pdf/2205.14182v1,,27/05/2022 19:18,cs.CL,http://arxiv.org/abs/2205.14182v1,0,2923
detecting label errors in token classification data,http://arxiv.org/pdf/2210.03920v1,,08/10/2022 06:14,cs.CL,http://arxiv.org/abs/2210.03920v1,0,2929
"eleutherai: going beyond ""open science"" to ""science in the open""",http://arxiv.org/pdf/2210.06413v1,,12/10/2022 18:06,cs.CL,http://arxiv.org/abs/2210.06413v1,0,2931
this joke is [mask]: recognizing humor and offense with prompting,http://arxiv.org/pdf/2210.13985v1,,25/10/2022 14:02,cs.CL,http://arxiv.org/abs/2210.13985v1,0,2934
ta-da: topic-aware domain adaptation for scientific keyphrase identification and classification (student abstract),http://arxiv.org/pdf/2301.06902v1,,30/12/2022 15:07,cs.CL,http://arxiv.org/abs/2301.06902v1,0,2937
inter-annotator agreement in the wild: uncovering its emerging roles and considerations in real-world scenarios,http://arxiv.org/pdf/2306.14373v1,,26/06/2023 02:28,cs.CL,http://arxiv.org/abs/2306.14373v1,0,2947
schema-driven actionable insight generation and smart recommendation,http://arxiv.org/pdf/2307.13176v1,,25/07/2023 00:53,cs.CL,http://arxiv.org/abs/2307.13176v1,0,2951
can prosody aid the automatic classification of dialog acts in conversational speech?,http://arxiv.org/pdf/cs/0006024v1,,11/06/2000 07:00,cs.CL,http://arxiv.org/abs/cs/0006024v1,0,2975
"r$^2$f: a general retrieval, reading and fusion framework for document-level natural language inference",http://arxiv.org/pdf/2210.12328v1,,22/10/2022 03:02,cs.CL,http://arxiv.org/abs/2210.12328v1,0,2993
deep learning and sub-word-unit approach in written art generation,http://arxiv.org/pdf/1901.07426v1,,22/01/2019 15:42,cs.CL,http://arxiv.org/abs/1901.07426v1,0,3008
knowledge efficient deep learning for natural language processing,http://arxiv.org/pdf/2008.12878v1,,29/08/2020 00:32,cs.CL,http://arxiv.org/abs/2008.12878v1,0,3009
knowgraph@iitk at semeval-2021 task 11: building knowledgegraph for nlp research,http://arxiv.org/pdf/2104.01619v1,,04/04/2021 15:33,cs.CL,http://arxiv.org/abs/2104.01619v1,0,3010
