Title,PDF URL,DOI,Published Date,Primary Category,Entry ID,Citation Count,Paper ID
architext: language-driven generative architecture design,http://arxiv.org/pdf/2303.07519v3,,13/03/2023 23:11,cs.CL,http://arxiv.org/abs/2303.07519v3,1,2220
drbert: a robust pre-trained model in french for biomedical and clinical domains,http://arxiv.org/pdf/2304.00958v2,,03/04/2023 14:25,cs.CL,http://arxiv.org/abs/2304.00958v2,1,2222
the language of sounds unheard: exploring musical timbre semantics of large language models,http://arxiv.org/pdf/2304.07830v3,,16/04/2023 17:50,cs.CL,http://arxiv.org/abs/2304.07830v3,1,2223
a comparative study between full-parameter and lora-based fine-tuning on chinese instruction data for instruction following large language model,http://arxiv.org/pdf/2304.08109v2,,17/04/2023 10:36,cs.CL,http://arxiv.org/abs/2304.08109v2,1,2224
ixa/cogcomp at semeval-2023 task 2: context-enriched multilingual named entity recognition using knowledge bases,http://arxiv.org/pdf/2304.10637v3,,20/04/2023 21:30,cs.CL,http://arxiv.org/abs/2304.10637v3,1,2226
what does bert learn about prosody?,http://arxiv.org/pdf/2304.12706v1,,25/04/2023 11:34,cs.CL,http://arxiv.org/abs/2304.12706v1,1,2228
evaluating inter-bilingual semantic parsing for indian languages,http://arxiv.org/pdf/2304.13005v2,,25/04/2023 18:24,cs.CL,http://arxiv.org/abs/2304.13005v2,1,2229
using language models to detect alarming student responses,http://arxiv.org/pdf/2305.07709v1,,12/05/2023 19:07,cs.CL,http://arxiv.org/abs/2305.07709v1,1,2230
kanbun-lm: reading and translating classical chinese in japanese methods by language models,http://arxiv.org/pdf/2305.12759v1,,22/05/2023 07:30,cs.CL,http://arxiv.org/abs/2305.12759v1,1,2233
a trip towards fairness: bias and de-biasing in large language models,http://arxiv.org/pdf/2305.13862v2,,23/05/2023 10:35,cs.CL,http://arxiv.org/abs/2305.13862v2,1,2235
from characters to words: hierarchical pre-trained language model for open-vocabulary language understanding,http://arxiv.org/pdf/2305.14571v2,,24/05/2023 00:22,cs.CL,http://arxiv.org/abs/2305.14571v2,1,2237
lexical retrieval hypothesis in multimodal context,http://arxiv.org/pdf/2305.17663v1,,28/05/2023 09:17,cs.CL,http://arxiv.org/abs/2305.17663v1,1,2238
robertweet: a bert language model for romanian tweets,http://arxiv.org/pdf/2306.06598v1,,11/06/2023 07:11,cs.CL,http://arxiv.org/abs/2306.06598v1,1,2240
easyguide : esg issue identification framework leveraging abilities of generative large language models,http://arxiv.org/pdf/2306.06662v2,,11/06/2023 13:25,cs.CL,http://arxiv.org/abs/2306.06662v2,1,2241
average-hard attention transformers are constant-depth uniform threshold circuits,http://arxiv.org/pdf/2308.03212v2,,06/08/2023 22:23,cs.CL,http://arxiv.org/abs/2308.03212v2,1,2243
through the lens of core competency: survey on evaluation of large language models,http://arxiv.org/pdf/2308.07902v1,,15/08/2023 18:40,cs.CL,http://arxiv.org/abs/2308.07902v1,1,2245
llm2kb: constructing knowledge bases using instruction tuned context aware large language models,http://arxiv.org/pdf/2308.13207v1,,25/08/2023 08:04,cs.CL,http://arxiv.org/abs/2308.13207v1,1,2246
leveraging knowledge and reinforcement learning for enhanced reliability of language models,http://arxiv.org/pdf/2308.13467v1,,25/08/2023 17:11,cs.CL,http://arxiv.org/abs/2308.13467v1,1,2247
explainability for large language models: a survey,http://arxiv.org/pdf/2309.01029v2,,02/09/2023 23:14,cs.CL,http://arxiv.org/abs/2309.01029v2,1,2248
fuzzy fingerprinting transformer language-models for emotion recognition in conversations,http://arxiv.org/pdf/2309.04292v1,,08/09/2023 13:26,cs.CL,http://arxiv.org/abs/2309.04292v1,1,2249
distributional data augmentation methods for low resource language,http://arxiv.org/pdf/2309.04862v1,,09/09/2023 20:01,cs.CL,http://arxiv.org/abs/2309.04862v1,1,2250
recovering from privacy-preserving masking with large language models,http://arxiv.org/pdf/2309.08628v2,,12/09/2023 17:39,cs.CL,http://arxiv.org/abs/2309.08628v2,1,2253
"mixed-distil-bert: code-mixed language modeling for bangla, english, and hindi",http://arxiv.org/pdf/2309.10272v1,,19/09/2023 03:59,cs.CL,http://arxiv.org/abs/2309.10272v1,1,2255
universlu: universal spoken language understanding for diverse classification and sequence generation tasks with a single network,http://arxiv.org/pdf/2310.02973v1,,04/10/2023 18:10,cs.CL,http://arxiv.org/abs/2310.02973v1,1,2256
a brief history of prompt: leveraging language models,http://arxiv.org/pdf/2310.04438v1,,30/09/2023 23:27,cs.CL,http://arxiv.org/abs/2310.04438v1,1,2257
fingpt: instruction tuning benchmark for open-source large language models in financial datasets,http://arxiv.org/pdf/2310.04793v1,,07/10/2023 13:52,cs.CL,http://arxiv.org/abs/2310.04793v1,1,2258
"the past, present and better future of feedback learning in large language models for subjective human preferences and values",http://arxiv.org/pdf/2310.07629v1,,11/10/2023 17:18,cs.CL,http://arxiv.org/abs/2310.07629v1,1,2259
eliciting human preferences with language models,http://arxiv.org/pdf/2310.11589v1,,17/10/2023 22:11,cs.CL,http://arxiv.org/abs/2310.11589v1,1,2260
natcs: eliciting natural customer support dialogues,http://arxiv.org/pdf/2305.03007v1,,04/05/2023 18:25,cs.CL,http://arxiv.org/abs/2305.03007v1,1,2261
generative data augmentation using llms improves distributional robustness in question answering,http://arxiv.org/pdf/2309.06358v1,,03/09/2023 04:27,cs.CL,http://arxiv.org/abs/2309.06358v1,1,2262
identifying bengali multiword expressions using semantic clustering,http://arxiv.org/pdf/1401.6122v1,,23/01/2014 19:03,cs.CL,http://arxiv.org/abs/1401.6122v1,1,2267
residualized factor adaptation for community social media prediction tasks,http://arxiv.org/pdf/1808.09479v1,,28/08/2018 19:23,cs.CL,http://arxiv.org/abs/1808.09479v1,1,2269
multilingual medical question answering and information retrieval for rural health intelligence access,http://arxiv.org/pdf/2106.01251v1,,02/06/2021 17:05,cs.CL,http://arxiv.org/abs/2106.01251v1,1,2272
rethinking end-to-end evaluation of decomposable tasks: a case study on spoken language understanding,http://arxiv.org/pdf/2106.15065v1,,29/06/2021 03:53,cs.CL,http://arxiv.org/abs/2106.15065v1,1,2273
yuan 1.0: large-scale pre-trained language model in zero-shot and few-shot learning,http://arxiv.org/pdf/2110.04725v2,,10/10/2021 08:40,cs.CL,http://arxiv.org/abs/2110.04725v2,1,2274
linguistic knowledge in data augmentation for natural language processing: an example on chinese question matching,http://arxiv.org/pdf/2111.14709v3,,29/11/2021 17:07,cs.CL,http://arxiv.org/abs/2111.14709v3,1,2275
near-term advances in quantum natural language processing,http://arxiv.org/pdf/2206.02171v2,,05/06/2022 14:10,cs.CL,http://arxiv.org/abs/2206.02171v2,1,2276
tweetnlp: cutting-edge natural language processing for social media,http://arxiv.org/pdf/2206.14774v3,,29/06/2022 18:16,cs.CL,http://arxiv.org/abs/2206.14774v3,1,2278
benchmarking faithfulness: towards accurate natural language explanations in vision-language tasks,http://arxiv.org/pdf/2304.08174v1,,03/04/2023 09:24,cs.CL,http://arxiv.org/abs/2304.08174v1,1,2281
construction grammar and language models,http://arxiv.org/pdf/2308.13315v2,,25/08/2023 12:37,cs.CL,http://arxiv.org/abs/2308.13315v2,1,2283
an empirical evaluation of prompting strategies for large language models in zero-shot clinical natural language processing,http://arxiv.org/pdf/2309.08008v1,,14/09/2023 20:35,cs.CL,http://arxiv.org/abs/2309.08008v1,1,2284
language models sounds the death knell of knowledge graphs,http://arxiv.org/pdf/2301.03980v1,,10/01/2023 14:20,cs.CL,http://arxiv.org/abs/2301.03980v1,1,2287
turning speech into scripts,http://arxiv.org/pdf/cs/0006017v1,,09/06/2000 18:28,cs.CL,http://arxiv.org/abs/cs/0006017v1,1,2289
a sheaf model of contradictions and disagreements. preliminary report and discussion,http://arxiv.org/pdf/1801.09036v1,,27/01/2018 05:13,cs.CL,http://arxiv.org/abs/1801.09036v1,1,2296
anaphoric binding: an integrated overview,http://arxiv.org/pdf/2103.06924v1,,11/03/2021 19:48,cs.CL,http://arxiv.org/abs/2103.06924v1,1,2302
virtual augmentation supported contrastive learning of sentence representations,http://arxiv.org/pdf/2110.08552v2,,16/10/2021 12:29,cs.CL,http://arxiv.org/abs/2110.08552v2,1,2309
intent matching based customer services chatbot with natural language understanding,http://arxiv.org/pdf/2202.00480v1,,07/01/2022 08:30,cs.CL,http://arxiv.org/abs/2202.00480v1,1,2312
evaluation of question answering systems: complexity of judging a natural language,http://arxiv.org/pdf/2209.12617v1,,10/09/2022 13:29,cs.CL,http://arxiv.org/abs/2209.12617v1,1,2314
tess: text-to-text self-conditioned simplex diffusion,http://arxiv.org/pdf/2305.08379v1,,15/05/2023 07:33,cs.CL,http://arxiv.org/abs/2305.08379v1,1,2316
active learning for natural language generation,http://arxiv.org/pdf/2305.15040v2,,24/05/2023 12:27,cs.CL,http://arxiv.org/abs/2305.15040v2,1,2317
cadge: context-aware dialogue generation enhanced with graph-structured knowledge aggregation,http://arxiv.org/pdf/2305.06294v2,,10/05/2023 17:31,cs.CL,http://arxiv.org/abs/2305.06294v2,1,2325
bridging fairness and environmental sustainability in natural language processing,http://arxiv.org/pdf/2211.04256v1,,08/11/2022 14:05,cs.CL,http://arxiv.org/abs/2211.04256v1,1,2331
rationalization for explainable nlp: a survey,http://arxiv.org/pdf/2301.08912v1,,21/01/2023 07:58,cs.CL,http://arxiv.org/abs/2301.08912v1,1,2333
aakos: aspect-adaptive knowledge-based opinion summarization,http://arxiv.org/pdf/2306.05537v1,,26/05/2023 04:44,cs.CL,http://arxiv.org/abs/2306.05537v1,1,2334
identifying symptoms of delirium from clinical narratives using natural language processing,http://arxiv.org/pdf/2304.00111v1,,31/03/2023 21:16,cs.CL,http://arxiv.org/abs/2304.00111v1,1,2337
towards controllable natural language inference through lexical inference types,http://arxiv.org/pdf/2308.03581v1,,07/08/2023 14:37,cs.CL,http://arxiv.org/abs/2308.03581v1,1,2338
wikiins: a high-quality dataset for controlled text editing by natural language instruction,http://arxiv.org/pdf/2310.05009v1,,08/10/2023 05:46,cs.CL,http://arxiv.org/abs/2310.05009v1,1,2339
graph algorithms for improving type-logical proof search,http://arxiv.org/pdf/0805.2303v1,,15/05/2008 14:30,cs.CL,http://arxiv.org/abs/0805.2303v1,1,2344
editorial for the first workshop on mining scientific papers: computational linguistics and bibliometrics,http://arxiv.org/pdf/1506.05402v1,,17/06/2015 19:03,cs.CL,http://arxiv.org/abs/1506.05402v1,1,2350
gov2vec: learning distributed representations of institutions and their legal text,http://arxiv.org/pdf/1609.06616v2,,21/09/2016 17:09,cs.CL,http://arxiv.org/abs/1609.06616v2,1,2353
syntactic enhancement to vsimm for roadmap based anomalous trajectory detection: a natural language processing approach,http://arxiv.org/pdf/1611.03466v3,,10/11/2016 20:13,cs.CL,http://arxiv.org/abs/1611.03466v3,1,2356
a survey of embedding models of entities and relationships for knowledge graph completion,http://arxiv.org/pdf/1703.08098v9,,23/03/2017 15:15,cs.CL,http://arxiv.org/abs/1703.08098v9,1,2358
automatic summarization of online debates,http://arxiv.org/pdf/1708.04587v1,,15/08/2017 17:44,cs.CL,http://arxiv.org/abs/1708.04587v1,1,2359
a structured distributional model of sentence meaning and processing,http://arxiv.org/pdf/1906.07280v1,,17/06/2019 22:31,cs.CL,http://arxiv.org/abs/1906.07280v1,1,2362
socialnlp emotionx challenge overview: predicting emotions in spoken dialogues and chats,http://arxiv.org/pdf/1909.07734v2,,17/09/2019 12:55,cs.CL,http://arxiv.org/abs/1909.07734v2,1,2366
using distributed representations to disambiguate biomedical and clinical concepts,http://arxiv.org/pdf/1608.05605v1,,19/08/2016 15:05,cs.CL,http://arxiv.org/abs/1608.05605v1,1,2372
explaining queries over web tables to non-experts,http://arxiv.org/pdf/1808.04614v1,,14/08/2018 11:23,cs.CL,http://arxiv.org/abs/1808.04614v1,1,2373
unsupervised cross-domain word representation learning,http://arxiv.org/pdf/1505.07184v1,,27/05/2015 05:02,cs.CL,http://arxiv.org/abs/1505.07184v1,1,2375
lexnlp: natural language processing and information extraction for legal and regulatory texts,http://arxiv.org/pdf/1806.03688v1,,10/06/2018 17:55,cs.CL,http://arxiv.org/abs/1806.03688v1,1,2376
aspect category detection via topic-attention network,http://arxiv.org/pdf/1901.01183v2,,04/01/2019 15:52,cs.CL,http://arxiv.org/abs/1901.01183v2,1,2379
graph neural networks with generated parameters for relation extraction,http://arxiv.org/pdf/1902.00756v1,,02/02/2019 17:34,cs.CL,http://arxiv.org/abs/1902.00756v1,1,2382
empirical evaluation of multi-task learning in deep neural networks for natural language processing,http://arxiv.org/pdf/1908.07820v2,,16/08/2019 04:16,cs.CL,http://arxiv.org/abs/1908.07820v2,1,2392
compositional neural machine translation by removing the lexicon from syntax,http://arxiv.org/pdf/2002.08899v1,,06/02/2020 18:51,cs.CL,http://arxiv.org/abs/2002.08899v1,1,2396
a sentiwordnet strategy for curriculum learning in sentiment analysis,http://arxiv.org/pdf/2005.04749v2,,10/05/2020 19:50,cs.CL,http://arxiv.org/abs/2005.04749v2,1,2400
long-term memory networks for question answering,http://arxiv.org/pdf/1707.01961v1,,06/07/2017 21:48,cs.CL,http://arxiv.org/abs/1707.01961v1,1,2403
abstractive summarization using attentive neural techniques,http://arxiv.org/pdf/1810.08838v1,,20/10/2018 19:24,cs.CL,http://arxiv.org/abs/1810.08838v1,1,2405
proactive security: embedded ai solution for violent and abusive speech recognition,http://arxiv.org/pdf/1810.09431v1,,22/10/2018 18:56,cs.CL,http://arxiv.org/abs/1810.09431v1,1,2406
bayesian compression for natural language processing,http://arxiv.org/pdf/1810.10927v2,,25/10/2018 16:27,cs.CL,http://arxiv.org/abs/1810.10927v2,1,2408
variational inference for learning representations of natural language edits,http://arxiv.org/pdf/2004.09143v4,,20/04/2020 10:08,cs.CL,http://arxiv.org/abs/2004.09143v4,1,2413
what are we depressed about when we talk about covid19: mental health analysis on tweets using natural language processing,http://arxiv.org/pdf/2004.10899v3,,23/04/2020 00:45,cs.CL,http://arxiv.org/abs/2004.10899v3,1,2414
towards an evolutionary-based approach for natural language processing,http://arxiv.org/pdf/2004.13832v1,,23/04/2020 19:44,cs.CL,http://arxiv.org/abs/2004.13832v1,1,2415
the role of context in neural pitch accent detection in english,http://arxiv.org/pdf/2004.14846v2,,30/04/2020 15:59,cs.CL,http://arxiv.org/abs/2004.14846v2,1,2416
improving constituency parsing with span attention,http://arxiv.org/pdf/2010.07543v1,,15/10/2020 07:36,cs.CL,http://arxiv.org/abs/2010.07543v1,1,2424
improving natural language processing tasks with human gaze-guided neural attention,http://arxiv.org/pdf/2010.07891v2,,15/10/2020 18:14,cs.CL,http://arxiv.org/abs/2010.07891v2,1,2425
transgender community sentiment analysis from social media data: a natural language processing approach,http://arxiv.org/pdf/2010.13062v2,,25/10/2020 08:13,cs.CL,http://arxiv.org/abs/2010.13062v2,1,2427
inserting information bottlenecks for attribution in transformers,http://arxiv.org/pdf/2012.13838v2,,27/12/2020 00:35,cs.CL,http://arxiv.org/abs/2012.13838v2,1,2430
towards zero-shot knowledge distillation for natural language processing,http://arxiv.org/pdf/2012.15495v1,,31/12/2020 08:16,cs.CL,http://arxiv.org/abs/2012.15495v1,1,2431
emplite: a lightweight sequence labeling model for emphasis selection of short texts,http://arxiv.org/pdf/2101.03025v1,,15/12/2020 19:00,cs.CL,http://arxiv.org/abs/2101.03025v1,1,2432
learning to match mathematical statements with proofs,http://arxiv.org/pdf/2102.02110v1,,03/02/2021 15:38,cs.CL,http://arxiv.org/abs/2102.02110v1,1,2433
socialnlp emotiongif challenge overview: predicting reaction gif categories on social media,http://arxiv.org/pdf/2102.12073v1,,24/02/2021 05:22,cs.CL,http://arxiv.org/abs/2102.12073v1,1,2434
token-modification adversarial attacks for natural language processing: a survey,http://arxiv.org/pdf/2103.00676v2,,01/03/2021 01:00,cs.CL,http://arxiv.org/abs/2103.00676v2,1,2435
you can do better! if you elaborate the reason when making prediction,http://arxiv.org/pdf/2103.14919v2,,27/03/2021 14:55,cs.CL,http://arxiv.org/abs/2103.14919v2,1,2438
tweenlp: a twitter exploration portal for natural language processing,http://arxiv.org/pdf/2106.10512v1,,19/06/2021 16:11,cs.CL,http://arxiv.org/abs/2106.10512v1,1,2442
dicoe@finsim-3: financial hypernym detection using augmented terms and distance-based features,http://arxiv.org/pdf/2109.14906v1,,30/09/2021 09:01,cs.CL,http://arxiv.org/abs/2109.14906v1,1,2446
we need to talk about data: the importance of data readiness in natural language processing,http://arxiv.org/pdf/2110.05464v1,,11/10/2021 18:55,cs.CL,http://arxiv.org/abs/2110.05464v1,1,2449
interpreting deep learning models in natural language processing: a review,http://arxiv.org/pdf/2110.10470v2,,20/10/2021 11:17,cs.CL,http://arxiv.org/abs/2110.10470v2,1,2451
rethink the evaluation for attack strength of backdoor attacks in natural language processing,http://arxiv.org/pdf/2201.02993v2,,09/01/2022 12:34,cs.CL,http://arxiv.org/abs/2201.02993v2,1,2452
a survey of multi-task learning in natural language processing: regarding task relatedness and training methods,http://arxiv.org/pdf/2204.03508v2,,07/04/2022 16:22,cs.CL,http://arxiv.org/abs/2204.03508v2,1,2457
"mapping the multilingual margins: intersectional biases of sentiment analysis systems in english, spanish, and arabic",http://arxiv.org/pdf/2204.03558v1,,07/04/2022 17:33,cs.CL,http://arxiv.org/abs/2204.03558v1,1,2458
"knowledge-aware document summarization: a survey of knowledge, embedding methods and architectures",http://arxiv.org/pdf/2204.11190v2,,24/04/2022 05:36,cs.CL,http://arxiv.org/abs/2204.11190v2,1,2461
suggesting relevant questions for a query using statistical natural language processing technique,http://arxiv.org/pdf/2204.12069v1,,26/04/2022 05:30,cs.CL,http://arxiv.org/abs/2204.12069v1,1,2462
analyzing folktales of different regions using topic modeling and clustering,http://arxiv.org/pdf/2206.04221v1,,09/06/2022 03:04,cs.CL,http://arxiv.org/abs/2206.04221v1,1,2467
searching for chromate replacements using natural language processing and machine learning algorithms,http://arxiv.org/pdf/2208.05672v1,,11/08/2022 08:21,cs.CL,http://arxiv.org/abs/2208.05672v1,1,2471
on the evolution of research in hypersonics: application of natural language processing and machine learning,http://arxiv.org/pdf/2208.08507v1,,17/08/2022 20:57,cs.CL,http://arxiv.org/abs/2208.08507v1,1,2472
brand celebrity matching model based on natural language processing,http://arxiv.org/pdf/2208.08887v1,,18/08/2022 16:07,cs.CL,http://arxiv.org/abs/2208.08887v1,1,2473
tracing semantic variation in slang,http://arxiv.org/pdf/2210.08635v2,,16/10/2022 21:51,cs.CL,http://arxiv.org/abs/2210.08635v2,1,2477
using focal loss to fight shallow heuristics: an empirical analysis of modulated cross-entropy in natural language inference,http://arxiv.org/pdf/2211.13331v1,,23/11/2022 22:19,cs.CL,http://arxiv.org/abs/2211.13331v1,1,2482
testing the effectiveness of saliency-based explainability in nlp using randomized survey-based experiments,http://arxiv.org/pdf/2211.15351v1,,25/11/2022 08:49,cs.CL,http://arxiv.org/abs/2211.15351v1,1,2484
measuring the measuring tools: an automatic evaluation of semantic metrics for text corpora,http://arxiv.org/pdf/2211.16259v1,,29/11/2022 14:47,cs.CL,http://arxiv.org/abs/2211.16259v1,1,2485
the decades progress on code-switching research in nlp: a systematic survey on trends and challenges,http://arxiv.org/pdf/2212.09660v2,,19/12/2022 17:42,cs.CL,http://arxiv.org/abs/2212.09660v2,1,2486
the exploration of knowledge-preserving prompts for document summarisation,http://arxiv.org/pdf/2301.11719v4,,27/01/2023 14:05,cs.CL,http://arxiv.org/abs/2301.11719v4,1,2487
"types of approaches, applications and challenges in the development of sentiment analysis systems",http://arxiv.org/pdf/2303.11176v1,,09/03/2023 15:18,cs.CL,http://arxiv.org/abs/2303.11176v1,1,2492
a comparison of document similarity algorithms,http://arxiv.org/pdf/2304.01330v1,,03/04/2023 20:50,cs.CL,http://arxiv.org/abs/2304.01330v1,1,2493
static fuzzy bag-of-words: a lightweight sentence embedding algorithm,http://arxiv.org/pdf/2304.03098v1,,06/04/2023 15:25,cs.CL,http://arxiv.org/abs/2304.03098v1,1,2494
thorny roses: investigating the dual use dilemma in natural language processing,http://arxiv.org/pdf/2304.08315v1,,17/04/2023 15:37,cs.CL,http://arxiv.org/abs/2304.08315v1,1,2497
lessons learned from a citizen science project for natural language processing,http://arxiv.org/pdf/2304.12836v1,,25/04/2023 15:08,cs.CL,http://arxiv.org/abs/2304.12836v1,1,2498
imbert: making bert immune to insertion-based backdoor attacks,http://arxiv.org/pdf/2305.16503v1,,25/05/2023 23:08,cs.CL,http://arxiv.org/abs/2305.16503v1,1,2500
a cloud-based machine learning pipeline for the efficient extraction of insights from customer reviews,http://arxiv.org/pdf/2306.07786v2,,13/06/2023 15:07,cs.CL,http://arxiv.org/abs/2306.07786v2,1,2501
survey on sociodemographic bias in natural language processing,http://arxiv.org/pdf/2306.08158v3,,13/06/2023 23:07,cs.CL,http://arxiv.org/abs/2306.08158v3,1,2502
utilizing natural language processing for automated assessment of classroom discussion,http://arxiv.org/pdf/2306.14918v1,,21/06/2023 17:45,cs.CL,http://arxiv.org/abs/2306.14918v1,1,2503
parmesan: mathematical concept extraction for education,http://arxiv.org/pdf/2307.06699v2,,13/07/2023 12:55,cs.CL,http://arxiv.org/abs/2307.06699v2,1,2505
adversarial conversational shaping for intelligent agents,http://arxiv.org/pdf/2307.11785v1,,20/07/2023 13:44,cs.CL,http://arxiv.org/abs/2307.11785v1,1,2506
"improving knowledge distillation for bert models: loss functions, mapping methods, and weight tuning",http://arxiv.org/pdf/2308.13958v1,,26/08/2023 21:59,cs.CL,http://arxiv.org/abs/2308.13958v1,1,2507
bilevel scheduled sampling for dialogue generation,http://arxiv.org/pdf/2309.01953v1,,05/09/2023 06:05,cs.CL,http://arxiv.org/abs/2309.01953v1,1,2508
where are we in event-centric emotion analysis? bridging emotion role labeling and appraisal-based approaches,http://arxiv.org/pdf/2309.02092v3,,05/09/2023 10:56,cs.CL,http://arxiv.org/abs/2309.02092v3,1,2509
"chunk, align, select: a simple long-sequence processing method for transformers",http://arxiv.org/pdf/2308.13191v1,,25/08/2023 06:52,cs.CL,http://arxiv.org/abs/2308.13191v1,1,2514
ellogon: a new text engineering platform,http://arxiv.org/pdf/cs/0205017v1,,13/05/2002 12:18,cs.CL,http://arxiv.org/abs/cs/0205017v1,1,2517
morphological analysis for the maltese language: the challenges of a hybrid system,http://arxiv.org/pdf/1703.08701v1,,25/03/2017 14:56,cs.CL,http://arxiv.org/abs/1703.08701v1,1,2520
the fluidity of concept representations in human brain signals,http://arxiv.org/pdf/2002.08880v1,,20/02/2020 17:31,cs.CL,http://arxiv.org/abs/2002.08880v1,1,2528
a subword guided neural word segmentation model for sindhi,http://arxiv.org/pdf/2012.15079v1,,30/12/2020 08:31,cs.CL,http://arxiv.org/abs/2012.15079v1,1,2532
misspelling correction with pre-trained contextual language model,http://arxiv.org/pdf/2101.03204v1,,08/01/2021 20:11,cs.CL,http://arxiv.org/abs/2101.03204v1,1,2533
learning a word-level language model with sentence-level noise contrastive estimation for contextual sentence probability estimation,http://arxiv.org/pdf/2103.07875v1,,14/03/2021 09:17,cs.CL,http://arxiv.org/abs/2103.07875v1,1,2535
badpre: task-agnostic backdoor attacks to pre-trained nlp foundation models,http://arxiv.org/pdf/2110.02467v1,,06/10/2021 03:48,cs.CL,http://arxiv.org/abs/2110.02467v1,1,2538
"a survey on legal judgment prediction: datasets, metrics, models and challenges",http://arxiv.org/pdf/2204.04859v1,,11/04/2022 05:06,cs.CL,http://arxiv.org/abs/2204.04859v1,1,2543
differentially private decoding in large language models,http://arxiv.org/pdf/2205.13621v2,,26/05/2022 21:50,cs.CL,http://arxiv.org/abs/2205.13621v2,1,2545
mapping process for the task: wikidata statements to text as wikipedia sentences,http://arxiv.org/pdf/2210.12659v1,,23/10/2022 09:34,cs.CL,http://arxiv.org/abs/2210.12659v1,1,2548
semi-automated construction of food composition knowledge base,http://arxiv.org/pdf/2301.11322v1,,24/01/2023 22:08,cs.CL,http://arxiv.org/abs/2301.11322v1,1,2552
knowledge transfer from pre-trained language models to cif-based speech recognizers via hierarchical distillation,http://arxiv.org/pdf/2301.13003v2,,30/01/2023 15:44,cs.CL,http://arxiv.org/abs/2301.13003v2,1,2553
preference-grounded token-level guidance for language model fine-tuning,http://arxiv.org/pdf/2306.00398v2,,01/06/2023 08:00,cs.CL,http://arxiv.org/abs/2306.00398v2,1,2556
named entity recognition in resumes,http://arxiv.org/pdf/2306.13062v1,,22/06/2023 18:30,cs.CL,http://arxiv.org/abs/2306.13062v1,1,2559
exploring the integration of large language models into automatic speech recognition systems: an empirical study,http://arxiv.org/pdf/2307.06530v1,,13/07/2023 03:31,cs.CL,http://arxiv.org/abs/2307.06530v1,1,2560
a zero-shot and few-shot study of instruction-finetuned large language models applied to clinical and biomedical tasks,http://arxiv.org/pdf/2307.12114v1,,22/07/2023 16:58,cs.CL,http://arxiv.org/abs/2307.12114v1,1,2561
ambert: a pre-trained language model with multi-grained tokenization,http://arxiv.org/pdf/2008.11869v4,,27/08/2020 01:23,cs.CL,http://arxiv.org/abs/2008.11869v4,1,2567
learning as abduction: trainable natural logic theorem prover for natural language inference,http://arxiv.org/pdf/2010.15909v2,,29/10/2020 19:49,cs.CL,http://arxiv.org/abs/2010.15909v2,1,2568
simple contrastive representation adversarial learning for nlp tasks,http://arxiv.org/pdf/2111.13301v2,,26/11/2021 03:16,cs.CL,http://arxiv.org/abs/2111.13301v2,1,2569
