Title,PDF URL,DOI,Published Date,Primary Category,Entry ID,Citation Count,Paper ID
basic classes of grammars with prohibition,http://arxiv.org/pdf/1302.5181v1,,21/02/2013 04:58,cs.FL,http://arxiv.org/abs/1302.5181v1,1,102
exploring the naturalness of buggy code with recurrent neural networks,http://arxiv.org/pdf/1803.08793v1,,21/03/2018 16:14,cs.SE,http://arxiv.org/abs/1803.08793v1,1,112
knowledge engineering using large language models,http://arxiv.org/pdf/2310.00637v1,,01/10/2023 11:26,cs.AI,http://arxiv.org/abs/2310.00637v1,1,114
"knowledge representation for conceptual, motivational, and affective processes in natural language communication",http://arxiv.org/pdf/2210.08994v2,,26/09/2022 02:37,cs.AI,http://arxiv.org/abs/2210.08994v2,1,119
"natural language processing: she needs something old and something new (maybe something borrowed and something blue, too)",http://arxiv.org/pdf/cmp-lg/9512004v1,,21/12/1995 16:38,cmp-lg,http://arxiv.org/abs/cmp-lg/9512004v1,1,120
towards a natural language query processing system,http://arxiv.org/pdf/2009.12414v1,,25/09/2020 20:52,cs.IR,http://arxiv.org/abs/2009.12414v1,1,131
the language (and series) of hammersley-type processes,http://arxiv.org/pdf/1802.03436v2,,09/02/2018 20:04,cs.FL,http://arxiv.org/abs/1802.03436v2,1,138
codexdb: generating code for processing sql queries using gpt-3 codex,http://arxiv.org/pdf/2204.08941v1,,19/04/2022 16:19,cs.DB,http://arxiv.org/abs/2204.08941v1,1,166
leveraging large language models to generate answer set programs,http://arxiv.org/pdf/2307.07699v1,,15/07/2023 04:40,cs.AI,http://arxiv.org/abs/2307.07699v1,1,178
from natural language instructions to complex processes: issues in chaining trigger action rules,http://arxiv.org/pdf/2001.02462v1,,08/01/2020 11:44,cs.AI,http://arxiv.org/abs/2001.02462v1,1,180
specifying and verbalising answer set programs in controlled natural language,http://arxiv.org/pdf/1804.10765v1,,28/04/2018 10:12,cs.AI,http://arxiv.org/abs/1804.10765v1,1,190
improve bilingual tts using dynamic language and phonology embedding,http://arxiv.org/pdf/2212.03435v1,,07/12/2022 03:46,cs.SD,http://arxiv.org/abs/2212.03435v1,1,197
on the applicability of language models to block-based programs,http://arxiv.org/pdf/2302.03927v1,,08/02/2023 07:54,cs.PL,http://arxiv.org/abs/2302.03927v1,1,198
process-oriented parallel programming with an application to data-intensive computing,http://arxiv.org/pdf/1407.5524v1,,21/07/2014 16:16,cs.PL,http://arxiv.org/abs/1407.5524v1,1,199
natural language processing: structure and complexity,http://arxiv.org/pdf/cmp-lg/9607017v1,,13/07/1996 22:31,cmp-lg,http://arxiv.org/abs/cmp-lg/9607017v1,1,200
a fast partial parse of natural language sentences using a connectionist method,http://arxiv.org/pdf/cmp-lg/9503023v1,,22/03/1995 11:29,cmp-lg,http://arxiv.org/abs/cmp-lg/9503023v1,1,208
the role of the gricean maxims in the generation of referring expressions,http://arxiv.org/pdf/cmp-lg/9604006v1,,18/04/1996 10:16,cmp-lg,http://arxiv.org/abs/cmp-lg/9604006v1,1,209
graph interpolation grammars: a rule-based approach to the incremental parsing of natural languages,http://arxiv.org/pdf/cmp-lg/9804001v1,,02/04/1998 15:47,cmp-lg,http://arxiv.org/abs/cmp-lg/9804001v1,1,234
methods and tools for building the catalan wordnet,http://arxiv.org/pdf/cmp-lg/9806009v1,,11/06/1998 12:05,cmp-lg,http://arxiv.org/abs/cmp-lg/9806009v1,1,249
"a universal model for languages and cities, and their lifetimes",http://arxiv.org/pdf/physics/0703144v1,,14/03/2007 15:35,physics.comp-ph,http://arxiv.org/abs/physics/0703144v1,1,252
processing natural language about ongoing actions,http://arxiv.org/pdf/1607.06875v2,,23/07/2016 02:46,cs.AI,http://arxiv.org/abs/1607.06875v2,1,262
temporal video-language alignment network for reward shaping in reinforcement learning,http://arxiv.org/pdf/2302.03954v1,,08/02/2023 09:25,cs.RO,http://arxiv.org/abs/2302.03954v1,1,292
towards operational natural language,http://arxiv.org/pdf/1711.06518v1,,17/11/2017 13:02,cs.SE,http://arxiv.org/abs/1711.06518v1,1,294
exploring natural language processing methods for interactive behaviour modelling,http://arxiv.org/pdf/2303.16039v2,,28/03/2023 16:15,cs.HC,http://arxiv.org/abs/2303.16039v2,1,299
design and implementation of a computational lexicon for turkish,http://arxiv.org/pdf/cmp-lg/9702012v1,,19/02/1997 16:36,cmp-lg,http://arxiv.org/abs/cmp-lg/9702012v1,1,308
erra: an embodied representation and reasoning architecture for long-horizon language-conditioned manipulation tasks,http://arxiv.org/pdf/2304.02251v1,,05/04/2023 07:50,cs.RO,http://arxiv.org/abs/2304.02251v1,1,319
xdbtagger: explainable natural language interface to databases using keyword mappings and schema graph,http://arxiv.org/pdf/2210.03768v1,,07/10/2022 19:17,cs.DB,http://arxiv.org/abs/2210.03768v1,1,328
construction contract risk identification based on knowledge-augmented language model,http://arxiv.org/pdf/2309.12626v1,,22/09/2023 06:27,cs.AI,http://arxiv.org/abs/2309.12626v1,1,329
technical language supervision for intelligent fault diagnosis in process industry,http://arxiv.org/pdf/2112.07356v2,,11/12/2021 18:59,cs.AI,http://arxiv.org/abs/2112.07356v2,1,330
robust processing of natural language,http://arxiv.org/pdf/cmp-lg/9507003v2,,13/07/1995 16:41,cmp-lg,http://arxiv.org/abs/cmp-lg/9507003v2,1,331
data readiness for natural language processing,http://arxiv.org/pdf/2009.02043v2,,04/09/2020 08:53,cs.CY,http://arxiv.org/abs/2009.02043v2,1,338
a constraint and object oriented fifth generation programming language and its compiler and runtime system,http://arxiv.org/pdf/2206.01024v1,,02/06/2022 13:55,cs.PL,http://arxiv.org/abs/2206.01024v1,1,342
ai-based question answering assistance for analyzing natural-language requirements,http://arxiv.org/pdf/2302.04793v1,,09/02/2023 17:31,cs.SE,http://arxiv.org/abs/2302.04793v1,1,357
large-scale photonic natural language processing,http://arxiv.org/pdf/2208.13649v1,,29/08/2022 15:52,cs.ET,http://arxiv.org/abs/2208.13649v1,1,360
memoization in constraint logic programming,http://arxiv.org/pdf/cmp-lg/9404005v1,,11/04/1994 18:22,cmp-lg,http://arxiv.org/abs/cmp-lg/9404005v1,1,364
learning to speak from text: zero-shot multilingual text-to-speech with unsupervised text pretraining,http://arxiv.org/pdf/2301.12596v3,,30/01/2023 00:53,eess.AS,http://arxiv.org/abs/2301.12596v3,1,380
language models as a knowledge source for cognitive agents,http://arxiv.org/pdf/2109.08270v3,,17/09/2021 02:12,cs.AI,http://arxiv.org/abs/2109.08270v3,1,396
lexicalization and grammar development,http://arxiv.org/pdf/cmp-lg/9410015v1,,21/10/1994 16:08,cmp-lg,http://arxiv.org/abs/cmp-lg/9410015v1,1,398
measuring semantic complexity,http://arxiv.org/pdf/cmp-lg/9505019v1,,08/05/1995 19:27,cmp-lg,http://arxiv.org/abs/cmp-lg/9505019v1,1,399
long-range and hierarchical language predictions in brains and algorithms,http://arxiv.org/pdf/2111.14232v1,,28/11/2021 20:26,q-bio.NC,http://arxiv.org/abs/2111.14232v1,1,418
modeling programs hierarchically with stack-augmented lstm,http://arxiv.org/pdf/2002.04516v1,,11/02/2020 16:17,cs.SE,http://arxiv.org/abs/2002.04516v1,1,432
a natural language query interface for searching personal information on smartwatches,http://arxiv.org/pdf/1611.07139v1,,22/11/2016 03:42,cs.HC,http://arxiv.org/abs/1611.07139v1,1,444
natural language for human-robot collaboration: problems beyond language grounding,http://arxiv.org/pdf/2110.04441v1,,09/10/2021 04:24,cs.AI,http://arxiv.org/abs/2110.04441v1,1,461
software infrastructure for natural language processing,http://arxiv.org/pdf/cmp-lg/9702005v1,,10/02/1997 21:07,cmp-lg,http://arxiv.org/abs/cmp-lg/9702005v1,1,471
fast statistical parsing of noun phrases for document indexing,http://arxiv.org/pdf/cmp-lg/9702009v1,,12/02/1997 16:30,cmp-lg,http://arxiv.org/abs/cmp-lg/9702009v1,1,478
a pointillism approach for natural language processing of social media,http://arxiv.org/pdf/1206.4958v1,,21/06/2012 19:17,cs.IR,http://arxiv.org/abs/1206.4958v1,1,485
natural language-guided programming,http://arxiv.org/pdf/2108.05198v2,,11/08/2021 14:06,cs.SE,http://arxiv.org/abs/2108.05198v2,1,496
amadeusgpt: a natural language interface for interactive animal behavioral analysis,http://arxiv.org/pdf/2307.04858v1,,10/07/2023 20:15,cs.HC,http://arxiv.org/abs/2307.04858v1,1,497
reshaping robot trajectories using natural language commands: a study of multi-modal data alignment using transformers,http://arxiv.org/pdf/2203.13411v1,,25/03/2022 01:36,cs.RO,http://arxiv.org/abs/2203.13411v1,1,499
dealing with metonymic readings of named entities,http://arxiv.org/pdf/cs/0607052v1,,11/07/2006 20:14,cs.AI,http://arxiv.org/abs/cs/0607052v1,1,517
"deep learning, natural language processing, and explainable artificial intelligence in the biomedical domain",http://arxiv.org/pdf/2202.12678v2,,25/02/2022 13:30,cs.AI,http://arxiv.org/abs/2202.12678v2,1,527
frameworks for querying databases using natural language: a literature review,http://arxiv.org/pdf/1909.01822v1,,03/09/2019 16:49,cs.DB,http://arxiv.org/abs/1909.01822v1,1,535
memory-based lexical acquisition and processing,http://arxiv.org/pdf/cmp-lg/9405018v1,,16/05/1994 15:03,cmp-lg,http://arxiv.org/abs/cmp-lg/9405018v1,1,536
shell language processing: unix command parsing for machine learning,http://arxiv.org/pdf/2107.02438v3,,06/07/2021 08:34,cs.LG,http://arxiv.org/abs/2107.02438v3,1,541
on the unexpected abilities of large language models,http://arxiv.org/pdf/2308.09720v1,,09/08/2023 10:15,cs.AI,http://arxiv.org/abs/2308.09720v1,1,543
fastus: a cascaded finite-state transducer for extracting information from natural-language text,http://arxiv.org/pdf/cmp-lg/9705013v1,,20/05/1997 21:58,cmp-lg,http://arxiv.org/abs/cmp-lg/9705013v1,1,552
test-takers have a say: understanding the implications of the use of ai in language tests,http://arxiv.org/pdf/2307.09885v1,,19/07/2023 11:28,cs.CY,http://arxiv.org/abs/2307.09885v1,1,557
lanfrica: a participatory approach to documenting machine translation research on african languages,http://arxiv.org/pdf/2008.07302v1,,03/08/2020 19:14,cs.CY,http://arxiv.org/abs/2008.07302v1,1,567
ctal: pre-training cross-modal transformer for audio-and-language representations,http://arxiv.org/pdf/2109.00181v1,,01/09/2021 05:18,cs.SD,http://arxiv.org/abs/2109.00181v1,1,571
systematic review for ai-based language learning tools,http://arxiv.org/pdf/2111.04455v1,,29/10/2021 12:54,cs.CY,http://arxiv.org/abs/2111.04455v1,1,574
"a machine learning, natural language processing analysis of youth perspectives: key trends and focus areas for sustainable youth development policies",http://arxiv.org/pdf/2211.14321v1,,25/11/2022 02:43,cs.CY,http://arxiv.org/abs/2211.14321v1,1,589
language-oriented communication with semantic coding and knowledge distillation for text-to-image generation,http://arxiv.org/pdf/2309.11127v1,,20/09/2023 09:19,eess.SP,http://arxiv.org/abs/2309.11127v1,1,591
review of design of speech recognition and text analytics based digital banking customer interface and future directions of technology adoption,http://arxiv.org/pdf/1712.04640v1,,13/12/2017 07:43,cs.CY,http://arxiv.org/abs/1712.04640v1,1,593
"reinforcement learning and bandits for speech and language processing: tutorial, review and outlook",http://arxiv.org/pdf/2210.13623v2,,24/10/2022 22:49,cs.AI,http://arxiv.org/abs/2210.13623v2,1,595
the integer linear programming inference cookbook,http://arxiv.org/pdf/2307.00171v1,,01/07/2023 00:33,cs.AI,http://arxiv.org/abs/2307.00171v1,1,599
"using single layer networks for discrete, sequential data: an example from natural language processing",http://arxiv.org/pdf/cmp-lg/9709012v1,,23/09/1997 15:01,cmp-lg,http://arxiv.org/abs/cmp-lg/9709012v1,1,600
interactive task and concept learning from natural language instructions and gui demonstrations,http://arxiv.org/pdf/1909.00031v2,,30/08/2019 19:35,cs.HC,http://arxiv.org/abs/1909.00031v2,1,601
matrix dirichlet processes,http://arxiv.org/pdf/1612.04472v2,,14/12/2016 03:31,math.PR,http://arxiv.org/abs/1612.04472v2,1,604
natural language dialogue service for appointment scheduling agents,http://arxiv.org/pdf/cmp-lg/9702007v1,,11/02/1997 18:59,cmp-lg,http://arxiv.org/abs/cmp-lg/9702007v1,1,607
correction of noisy sentences using a monolingual corpus,http://arxiv.org/pdf/1105.4318v1,,22/05/2011 10:01,cs.DL,http://arxiv.org/abs/1105.4318v1,1,608
parsinorm: a persian toolkit for speech processing normalization,http://arxiv.org/pdf/2111.03470v2,,01/11/2021 17:41,eess.AS,http://arxiv.org/abs/2111.03470v2,1,617
chatgpt and other large language models as evolutionary engines for online interactive collaborative game design,http://arxiv.org/pdf/2303.02155v2,,09/02/2023 15:44,cs.AI,http://arxiv.org/abs/2303.02155v2,1,625
from natural language to simulations: applying gpt-3 codex to automate simulation modeling of logistics systems,http://arxiv.org/pdf/2202.12107v3,,24/02/2022 14:01,cs.AI,http://arxiv.org/abs/2202.12107v3,1,635
clare: a contextual reasoning and cooperative response framework for the core language engine,http://arxiv.org/pdf/cmp-lg/9411002v1,,01/11/1994 15:36,cmp-lg,http://arxiv.org/abs/cmp-lg/9411002v1,1,644
abstract machine for typed feature structures,http://arxiv.org/pdf/cmp-lg/9504009v1,,13/04/1995 06:36,cmp-lg,http://arxiv.org/abs/cmp-lg/9504009v1,1,645
on learning language-invariant representations for universal machine translation,http://arxiv.org/pdf/2008.04510v1,,11/08/2020 05:45,cs.LG,http://arxiv.org/abs/2008.04510v1,1,670
sceneseer: 3d scene design with natural language,http://arxiv.org/pdf/1703.00050v1,,28/02/2017 20:47,cs.GR,http://arxiv.org/abs/1703.00050v1,1,677
enabling robots to draw and tell: towards visually grounded multimodal description generation,http://arxiv.org/pdf/2101.12338v1,,14/01/2021 23:40,cs.RO,http://arxiv.org/abs/2101.12338v1,1,680
spa: verbal interactions between agents and avatars in shared virtual environments using propositional planning,http://arxiv.org/pdf/2002.03246v1,,08/02/2020 23:15,cs.MA,http://arxiv.org/abs/2002.03246v1,1,682
predicting digital asset prices using natural language processing: a survey,http://arxiv.org/pdf/2212.00726v1,,28/11/2022 17:37,cs.CY,http://arxiv.org/abs/2212.00726v1,1,706
lp-musiccaps: llm-based pseudo music captioning,http://arxiv.org/pdf/2307.16372v1,,31/07/2023 03:32,cs.SD,http://arxiv.org/abs/2307.16372v1,1,721
interpreting language models through knowledge graph extraction,http://arxiv.org/pdf/2111.08546v1,,16/11/2021 15:18,cs.LG,http://arxiv.org/abs/2111.08546v1,1,731
evaluating off-the-shelf machine listening and natural language models for automated audio captioning,http://arxiv.org/pdf/2110.07410v1,,14/10/2021 15:42,cs.LG,http://arxiv.org/abs/2110.07410v1,1,742
quantum natural language processing based sentiment analysis using lambeq toolkit,http://arxiv.org/pdf/2305.19383v1,,30/05/2023 20:54,quant-ph,http://arxiv.org/abs/2305.19383v1,1,745
codetrans: towards cracking the language of silicon's code through self-supervised deep learning and high performance computing,http://arxiv.org/pdf/2104.02443v2,,06/04/2021 12:57,cs.SE,http://arxiv.org/abs/2104.02443v2,1,746
a semantics-based communication system for dysphasic subjects,http://arxiv.org/pdf/cmp-lg/9703003v1,,12/03/1997 08:42,cmp-lg,http://arxiv.org/abs/cmp-lg/9703003v1,1,747
lambert: language and action learning using multimodal bert,http://arxiv.org/pdf/2004.07093v1,,15/04/2020 14:54,cs.LG,http://arxiv.org/abs/2004.07093v1,1,756
language models are drummers: drum composition with natural language pre-training,http://arxiv.org/pdf/2301.01162v1,,03/01/2023 15:47,cs.SD,http://arxiv.org/abs/2301.01162v1,1,775
chessgpt: bridging policy learning and language modeling,http://arxiv.org/pdf/2306.09200v1,,15/06/2023 16:35,cs.LG,http://arxiv.org/abs/2306.09200v1,1,784
zero-shot emotion transfer for cross-lingual speech synthesis,http://arxiv.org/pdf/2310.03963v1,,06/10/2023 02:18,cs.SD,http://arxiv.org/abs/2310.03963v1,1,786
towards a benchmark of natural language arguments,http://arxiv.org/pdf/1405.0941v1,,05/05/2014 17:03,cs.AI,http://arxiv.org/abs/1405.0941v1,1,810
riesz logic,http://arxiv.org/pdf/1410.2910v1,,10/10/2014 22:14,cs.LO,http://arxiv.org/abs/1410.2910v1,1,811
cb2: collaborative natural language interaction research platform,http://arxiv.org/pdf/2303.08127v3,,14/03/2023 17:57,cs.LG,http://arxiv.org/abs/2303.08127v3,1,825
robo sapiens,http://arxiv.org/pdf/2310.08323v1,,05/06/2023 09:39,cs.OH,http://arxiv.org/abs/2310.08323v1,1,827
morphological cues for lexical semantics,http://arxiv.org/pdf/cmp-lg/9606003v1,,04/06/1996 10:17,cmp-lg,http://arxiv.org/abs/cmp-lg/9606003v1,1,831
an empirical evaluation of probabilistic lexicalized tree insertion grammars,http://arxiv.org/pdf/cmp-lg/9808001v1,,04/08/1998 03:15,cmp-lg,http://arxiv.org/abs/cmp-lg/9808001v1,1,832
"robust natural language processing - combining reasoning, cognitive semantics and construction grammar for spatial language",http://arxiv.org/pdf/1607.05968v1,,20/07/2016 15:15,cs.AI,http://arxiv.org/abs/1607.05968v1,1,843
a quantum query complexity trichotomy for regular languages,http://arxiv.org/pdf/1812.04219v3,,11/12/2018 05:00,quant-ph,http://arxiv.org/abs/1812.04219v3,1,875
situated language learning via interactive narratives,http://arxiv.org/pdf/2103.09977v1,,18/03/2021 01:55,cs.AI,http://arxiv.org/abs/2103.09977v1,1,886
autotamp: autoregressive task and motion planning with llms as translators and checkers,http://arxiv.org/pdf/2306.06531v2,,10/06/2023 22:58,cs.RO,http://arxiv.org/abs/2306.06531v2,1,888
javabert: training a transformer-based model for the java programming language,http://arxiv.org/pdf/2110.10404v1,,20/10/2021 07:49,cs.SE,http://arxiv.org/abs/2110.10404v1,1,892
a simplistic model of neural scaling laws: multiperiodic santa fe processes,http://arxiv.org/pdf/2302.09049v1,,17/02/2023 18:27,cs.IT,http://arxiv.org/abs/2302.09049v1,1,893
exploring large language model for graph data understanding in online job recommendations,http://arxiv.org/pdf/2307.05722v1,,10/07/2023 12:29,cs.AI,http://arxiv.org/abs/2307.05722v1,1,897
toward code generation: a survey and lessons from semantic parsing,http://arxiv.org/pdf/2105.03317v1,,26/04/2021 23:05,cs.SE,http://arxiv.org/abs/2105.03317v1,1,912
text-based action-model acquisition for planning,http://arxiv.org/pdf/2202.08373v2,,15/02/2022 02:23,cs.LG,http://arxiv.org/abs/2202.08373v2,1,914
transformers and large language models for chemistry and drug discovery,http://arxiv.org/pdf/2310.06083v1,,09/10/2023 19:40,cs.LG,http://arxiv.org/abs/2310.06083v1,1,922
transformer-based language models for software vulnerability detection,http://arxiv.org/pdf/2204.03214v2,,07/04/2022 05:57,cs.CR,http://arxiv.org/abs/2204.03214v2,1,923
fishing for exactness,http://arxiv.org/pdf/cmp-lg/9608010v1,,16/08/1996 21:24,cmp-lg,http://arxiv.org/abs/cmp-lg/9608010v1,1,928
uw-bhi at mediqa 2019: an analysis of representation methods for medical natural language inference,http://arxiv.org/pdf/1907.04286v1,,09/07/2019 17:47,cs.IR,http://arxiv.org/abs/1907.04286v1,1,935
augmentedcode: examining the effects of natural language resources in code retrieval models,http://arxiv.org/pdf/2110.08512v1,,16/10/2021 09:44,cs.SE,http://arxiv.org/abs/2110.08512v1,1,939
calm: contrastive aligned audio-language multirate and multimodal representations,http://arxiv.org/pdf/2202.03587v1,,08/02/2022 01:20,eess.AS,http://arxiv.org/abs/2202.03587v1,1,949
relaxed attention for transformer models,http://arxiv.org/pdf/2209.09735v1,,20/09/2022 15:10,cs.LG,http://arxiv.org/abs/2209.09735v1,1,951
addressing the blind spots in spoken language processing,http://arxiv.org/pdf/2309.06572v1,,06/09/2023 11:29,eess.AS,http://arxiv.org/abs/2309.06572v1,1,957
ubiquitous talker: spoken language interaction with real world objects,http://arxiv.org/pdf/cmp-lg/9505038v1,,23/05/1995 08:14,cmp-lg,http://arxiv.org/abs/cmp-lg/9505038v1,1,958
nas-bench-nlp: neural architecture search benchmark for natural language processing,http://arxiv.org/pdf/2006.07116v1,,12/06/2020 13:19,cs.LG,http://arxiv.org/abs/2006.07116v1,1,982
"abstractions, scenarios, and prompt definitions for process mining with llms: a case study",http://arxiv.org/pdf/2307.02194v2,,05/07/2023 11:41,cs.DB,http://arxiv.org/abs/2307.02194v2,1,998
an algorithm to co-ordinate anaphora resolution and pps disambiguation process,http://arxiv.org/pdf/cmp-lg/9502033v1,,24/02/1995 19:34,cmp-lg,http://arxiv.org/abs/cmp-lg/9502033v1,1,999
towards ontology based bpmn implementation,http://arxiv.org/pdf/1811.07692v1,,07/11/2018 09:52,cs.SE,http://arxiv.org/abs/1811.07692v1,1,1009
rdf knowledge graph visualization from a knowledge extraction system,http://arxiv.org/pdf/1510.00244v1,,01/10/2015 15:10,cs.HC,http://arxiv.org/abs/1510.00244v1,1,1025
semantic folding theory and its application in semantic fingerprinting,http://arxiv.org/pdf/1511.08855v2,,28/11/2015 00:13,cs.AI,http://arxiv.org/abs/1511.08855v2,1,1031
document searching system based on natural language query processing for vietnam open courseware library,http://arxiv.org/pdf/0912.1829v1,,09/12/2009 18:38,cs.IR,http://arxiv.org/abs/0912.1829v1,1,1032
word2vec is a special case of kernel correspondence analysis and kernels for natural language processing,http://arxiv.org/pdf/1605.05087v3,,17/05/2016 11:07,cs.LG,http://arxiv.org/abs/1605.05087v3,1,1037
domain authoring assistant for intelligent virtual agents,http://arxiv.org/pdf/1904.03266v1,,05/04/2019 21:27,cs.AI,http://arxiv.org/abs/1904.03266v1,1,1041
interactive data analysis with next-step natural language query recommendation,http://arxiv.org/pdf/2201.04868v2,,13/01/2022 10:20,cs.HC,http://arxiv.org/abs/2201.04868v2,1,1048
neural code search revisited: enhancing code snippet retrieval through natural language intent,http://arxiv.org/pdf/2008.12193v1,,27/08/2020 16:39,cs.IR,http://arxiv.org/abs/2008.12193v1,1,1058
nalabs: detecting bad smells in natural language requirements and test specifications,http://arxiv.org/pdf/2202.05641v2,,11/02/2022 14:30,cs.SE,http://arxiv.org/abs/2202.05641v2,1,1059
automated smell detection and recommendation in natural language requirements,http://arxiv.org/pdf/2305.07097v1,,11/05/2023 20:01,cs.SE,http://arxiv.org/abs/2305.07097v1,1,1062
telephonetic: making neural language models robust to asr and semantic noise,http://arxiv.org/pdf/1906.05678v1,,13/06/2019 18:04,eess.AS,http://arxiv.org/abs/1906.05678v1,1,1066
automata and graph compression,http://arxiv.org/pdf/1502.07288v1,,25/02/2015 18:30,cs.IT,http://arxiv.org/abs/1502.07288v1,1,1070
variable name recovery in decompiled binary code using constrained masked language modeling,http://arxiv.org/pdf/2103.12801v1,,23/03/2021 19:09,cs.LG,http://arxiv.org/abs/2103.12801v1,1,1080
exploring the protein sequence space with global generative models,http://arxiv.org/pdf/2305.01941v1,,03/05/2023 08:45,q-bio.BM,http://arxiv.org/abs/2305.01941v1,1,1091
design and implementation of probabilistic programming language anglican,http://arxiv.org/pdf/1608.05263v2,,18/08/2016 15:00,cs.PL,http://arxiv.org/abs/1608.05263v2,1,1104
classical (co)recursion: programming,http://arxiv.org/pdf/2103.06913v1,,11/03/2021 19:13,cs.PL,http://arxiv.org/abs/2103.06913v1,1,1111
audio captioning using pre-trained large-scale language model guided by audio-based similar caption retrieval,http://arxiv.org/pdf/2012.07331v1,,14/12/2020 08:27,eess.AS,http://arxiv.org/abs/2012.07331v1,1,1125
wavprompt: towards few-shot spoken language understanding with frozen language models,http://arxiv.org/pdf/2203.15863v2,,29/03/2022 20:08,eess.AS,http://arxiv.org/abs/2203.15863v2,1,1144
health analytics: a systematic review of approaches to detect phenotype cohorts using electronic health records,http://arxiv.org/pdf/1707.07425v1,,24/07/2017 08:19,stat.ML,http://arxiv.org/abs/1707.07425v1,1,1184
report on the 3rd joint workshop on bibliometric-enhanced information retrieval and natural language processing for digital libraries (birndl 2018),http://arxiv.org/pdf/1812.00427v1,,02/12/2018 16:59,cs.IR,http://arxiv.org/abs/1812.00427v1,1,1185
ambiguity in language networks,http://arxiv.org/pdf/1402.4802v2,,18/02/2014 09:26,physics.soc-ph,http://arxiv.org/abs/1402.4802v2,1,1192
parameterized neural network language models for information retrieval,http://arxiv.org/pdf/1510.01562v1,,06/10/2015 14:07,cs.IR,http://arxiv.org/abs/1510.01562v1,1,1195
differential privacy and natural language processing to generate contextually similar decoy messages in honey encryption scheme,http://arxiv.org/pdf/2010.15985v1,,29/10/2020 23:02,cs.CR,http://arxiv.org/abs/2010.15985v1,1,1216
automatically reproducing android bug reports using natural language processing and reinforcement learning,http://arxiv.org/pdf/2301.07775v1,,18/01/2023 20:32,cs.SE,http://arxiv.org/abs/2301.07775v1,1,1220
interactively picking real-world objects with unconstrained spoken language instructions,http://arxiv.org/pdf/1710.06280v2,,17/10/2017 14:46,cs.RO,http://arxiv.org/abs/1710.06280v2,1,1224
isr-llm: iterative self-refined large language model for long-horizon sequential task planning,http://arxiv.org/pdf/2308.13724v1,,26/08/2023 02:31,cs.RO,http://arxiv.org/abs/2308.13724v1,1,1228
model explainability in deep learning based natural language processing,http://arxiv.org/pdf/2106.07410v1,,14/06/2021 14:23,cs.AI,http://arxiv.org/abs/2106.07410v1,1,1234
incorporating voice instructions in model-based reinforcement learning for self-driving cars,http://arxiv.org/pdf/2206.10249v1,,21/06/2022 11:55,cs.HC,http://arxiv.org/abs/2206.10249v1,1,1236
"from text to knowledge with graphs: modelling, querying and exploiting textual content",http://arxiv.org/pdf/2310.06122v1,,09/10/2023 20:57,cs.DB,http://arxiv.org/abs/2310.06122v1,1,1237
use of uml and model transformations for workflow process definitions,http://arxiv.org/pdf/cs/0607044v1,,11/07/2006 10:23,cs.SE,http://arxiv.org/abs/cs/0607044v1,1,1253
