Title,PdfUrl,PublishedDate,PrimaryCategory,PaperId,PublishedYear
enhancements to the boun treebank reflecting the agglutinative nature of turkish,http://arxiv.org/pdf/2207.11782v1,24/07/2022 18:56,cs.CL,2469,2022
the leaf clinical trials corpus: a new resource for query generation from clinical trial eligibility criteria,http://arxiv.org/pdf/2207.13757v1,27/07/2022 20:22,cs.CL,2470,2022
searching for chromate replacements using natural language processing and machine learning algorithms,http://arxiv.org/pdf/2208.05672v1,11/08/2022 08:21,cs.CL,2471,2022
on the evolution of research in hypersonics: application of natural language processing and machine learning,http://arxiv.org/pdf/2208.08507v1,17/08/2022 20:57,cs.CL,2472,2022
brand celebrity matching model based on natural language processing,http://arxiv.org/pdf/2208.08887v1,18/08/2022 16:07,cs.CL,2473,2022
combating high variance in data-scarce implicit hate speech classification,http://arxiv.org/pdf/2208.13595v1,29/08/2022 14:45,cs.CL,2474,2022
a decade of knowledge graphs in natural language processing: a survey,http://arxiv.org/pdf/2210.00105v1,30/09/2022 22:53,cs.CL,2476,2022
tracing semantic variation in slang,http://arxiv.org/pdf/2210.08635v2,16/10/2022 21:51,cs.CL,2477,2022
dyrex: dynamic query representation for extractive question answering,http://arxiv.org/pdf/2210.15048v1,26/10/2022 22:26,cs.CL,2479,2022
a critical reflection and forward perspective on empathy and natural language processing,http://arxiv.org/pdf/2210.16604v1,29/10/2022 14:57,cs.CL,2480,2022
"discover, explanation, improvement: an automatic slice detection framework for natural language processing",http://arxiv.org/pdf/2211.04476v2,08/11/2022 19:00,cs.CL,2481,2022
using focal loss to fight shallow heuristics: an empirical analysis of modulated cross-entropy in natural language inference,http://arxiv.org/pdf/2211.13331v1,23/11/2022 22:19,cs.CL,2482,2022
a survey of text representation methods and their genealogy,http://arxiv.org/pdf/2211.14591v1,26/11/2022 15:22,cs.CL,2483,2022
testing the effectiveness of saliency-based explainability in nlp using randomized survey-based experiments,http://arxiv.org/pdf/2211.15351v1,25/11/2022 08:49,cs.CL,2484,2022
measuring the measuring tools: an automatic evaluation of semantic metrics for text corpora,http://arxiv.org/pdf/2211.16259v1,29/11/2022 14:47,cs.CL,2485,2022
the decades progress on code-switching research in nlp: a systematic survey on trends and challenges,http://arxiv.org/pdf/2212.09660v2,19/12/2022 17:42,cs.CL,2486,2022
"a survey on legal judgment prediction: datasets, metrics, models and challenges",http://arxiv.org/pdf/2204.04859v1,11/04/2022 05:06,cs.CL,2543,2022
differentially private decoding in large language models,http://arxiv.org/pdf/2205.13621v2,26/05/2022 21:50,cs.CL,2545,2022
the state of profanity obfuscation in natural language processing,http://arxiv.org/pdf/2210.07595v1,14/10/2022 08:45,cs.CL,2547,2022
mapping process for the task: wikidata statements to text as wikipedia sentences,http://arxiv.org/pdf/2210.12659v1,23/10/2022 09:34,cs.CL,2548,2022
global memory transformer for processing long documents,http://arxiv.org/pdf/2212.01650v1,03/12/2022 16:40,cs.CL,2549,2022
rethinking with retrieval: faithful large language model inference,http://arxiv.org/pdf/2301.00303v1,31/12/2022 22:35,cs.CL,2550,2022
pir: a bilingual portuguese-english dataset for question-answering about the ocean,http://arxiv.org/pdf/2202.02398v1,04/02/2022 21:29,cs.CL,2574,2022
what do compressed multilingual machine translation models forget?,http://arxiv.org/pdf/2205.10828v4,22/05/2022 14:54,cs.CL,2593,2022
transcormer: transformer for sentence scoring with sliding language modeling,http://arxiv.org/pdf/2205.12986v4,25/05/2022 19:00,cs.CL,2594,2022
fine-tuning pre-trained language models with noise stability regularization,http://arxiv.org/pdf/2206.05658v1,12/06/2022 05:42,cs.CL,2595,2022
characterizing verbatim short-term memory in neural language models,http://arxiv.org/pdf/2210.13569v2,24/10/2022 20:47,cs.CL,2596,2022
dpcspell: a transformer-based detector-purificator-corrector framework for spelling error correction of bangla and resource scarce indic languages,http://arxiv.org/pdf/2211.03730v1,07/11/2022 17:59,cs.CL,2597,2022
ugif: ui grounded instruction following,http://arxiv.org/pdf/2211.07615v2,14/11/2022 18:36,cs.CL,2598,2022
incongruity detection between bangla news headline and body content through graph neural network,http://arxiv.org/pdf/2211.07709v1,26/10/2022 21:57,cs.CL,2599,2022
toward efficient language model pretraining and downstream adaptation via self-evolution: a case study on superglue,http://arxiv.org/pdf/2212.01853v1,04/12/2022 15:36,cs.CL,2600,2022
on information hiding in natural language systems,http://arxiv.org/pdf/2203.06512v1,12/03/2022 20:34,cs.CL,2637,2022
zeroberto: leveraging zero-shot text classification by topic modeling,http://arxiv.org/pdf/2201.01337v3,04/01/2022 20:08,cs.CL,2650,2022
part-of-speech tagging of odia language using statistical and deep learning-based approaches,http://arxiv.org/pdf/2207.03256v1,07/07/2022 13:15,cs.CL,2655,2022
vietnamese capitalization and punctuation recovery models,http://arxiv.org/pdf/2207.01312v1,04/07/2022 11:45,cs.CL,2687,2022
"look ma, only samples! revisiting the effectiveness of automatic n-gram rule generation for spelling normalization in filipino",http://arxiv.org/pdf/2210.02675v2,06/10/2022 05:41,cs.CL,2688,2022
short text pre-training with extended token classification for e-commerce query understanding,http://arxiv.org/pdf/2210.03915v1,08/10/2022 05:50,cs.CL,2689,2022
language models as inductive reasoners,http://arxiv.org/pdf/2212.10923v1,21/12/2022 11:12,cs.CL,2707,2022
clinical prompt learning with frozen language models,http://arxiv.org/pdf/2205.05535v1,11/05/2022 15:25,cs.CL,2727,2022
utilizing background knowledge for robust reasoning over traffic situations,http://arxiv.org/pdf/2212.07798v1,04/12/2022 09:17,cs.CL,2729,2022
"using deepspeed and megatron to train megatron-turing nlg 530b, a large-scale generative language model",http://arxiv.org/pdf/2201.11990v3,28/01/2022 08:59,cs.CL,2740,2022
bigbio: a framework for data-centric biomedical natural language processing,http://arxiv.org/pdf/2206.15076v1,30/06/2022 08:15,cs.CL,2742,2022
clustering text using attention,http://arxiv.org/pdf/2201.02816v1,08/01/2022 12:18,cs.CL,2909,2022
chatbot system architecture,http://arxiv.org/pdf/2201.06348v1,17/01/2022 11:07,cs.CL,2910,2022
topological data analysis for word sense disambiguation,http://arxiv.org/pdf/2203.00565v1,01/03/2022 15:41,cs.CL,2912,2022
towards equal opportunity fairness through adversarial learning,http://arxiv.org/pdf/2203.06317v2,12/03/2022 02:22,cs.CL,2913,2022
small batch sizes improve training of low-resource neural mt,http://arxiv.org/pdf/2203.10579v1,20/03/2022 15:14,cs.CL,2914,2022
su-nlp at semeval-2022 task 11: complex named entity recognition with entity linking,http://arxiv.org/pdf/2203.11841v1,22/03/2022 16:09,cs.CL,2915,2022
learning disentangled representations of negation and uncertainty,http://arxiv.org/pdf/2204.00511v1,01/04/2022 16:12,cs.CL,2916,2022
state of the art in artificial intelligence applied to the legal domain,http://arxiv.org/pdf/2204.07047v1,10/03/2022 16:20,cs.CL,2917,2022
word tour: one-dimensional word embeddings via the traveling salesman problem,http://arxiv.org/pdf/2205.01954v1,04/05/2022 09:46,cs.CL,2920,2022
math-kg: construction and applications of mathematical knowledge graph,http://arxiv.org/pdf/2205.03772v1,08/05/2022 04:39,cs.CL,2921,2022
asking the right questions in low resource template extraction,http://arxiv.org/pdf/2205.12643v1,25/05/2022 11:39,cs.CL,2922,2022
who is we? disambiguating the referents of first person plural pronouns in parliamentary debates,http://arxiv.org/pdf/2205.14182v1,27/05/2022 19:18,cs.CL,2923,2022
ratatouille: a tool for novel recipe generation,http://arxiv.org/pdf/2206.08267v1,10/05/2022 12:20,cs.CL,2924,2022
modern question answering datasets and benchmarks: a survey,http://arxiv.org/pdf/2206.15030v1,30/06/2022 06:53,cs.CL,2925,2022
multilingual persuasion detection: video games as an invaluable data source for nlp,http://arxiv.org/pdf/2207.04453v1,10/07/2022 13:38,cs.CL,2926,2022
detecting label errors in token classification data,http://arxiv.org/pdf/2210.03920v1,08/10/2022 06:14,cs.CL,2929,2022
"eleutherai: going beyond ""open science"" to ""science in the open""",http://arxiv.org/pdf/2210.06413v1,12/10/2022 18:06,cs.CL,2931,2022
towards domain-independent supervised discourse parsing through gradient boosting,http://arxiv.org/pdf/2210.09565v1,18/10/2022 04:44,cs.CL,2932,2022
stance detection and open research avenues,http://arxiv.org/pdf/2210.12383v1,22/10/2022 09:18,cs.CL,2933,2022
this joke is [mask]: recognizing humor and offense with prompting,http://arxiv.org/pdf/2210.13985v1,25/10/2022 14:02,cs.CL,2934,2022
large discourse treebanks from scalable distant supervision,http://arxiv.org/pdf/2212.06038v1,18/10/2022 04:33,cs.CL,2935,2022
human in the loop: how to effectively create coherent topics by manually labeling only a few documents per class,http://arxiv.org/pdf/2212.09422v1,19/12/2022 12:57,cs.CL,2936,2022
ta-da: topic-aware domain adaptation for scientific keyphrase identification and classification (student abstract),http://arxiv.org/pdf/2301.06902v1,30/12/2022 15:07,cs.CL,2937,2022
bias at a second glance: a deep dive into bias for german educational peer-review data modeling,http://arxiv.org/pdf/2209.10335v2,21/09/2022 14:08,cs.CL,2963,2022
design and implementation of a quantum kernel for natural language processing,http://arxiv.org/pdf/2205.06409v1,13/05/2022 01:45,cs.CL,2964,2022
"r$^2$f: a general retrieval, reading and fusion framework for document-level natural language inference",http://arxiv.org/pdf/2210.12328v1,22/10/2022 03:02,cs.CL,2993,2022
noun2verb: probabilistic frame semantics for word class conversion,http://arxiv.org/pdf/2205.06321v1,12/05/2022 20:16,cs.CL,3020,2022
few-shot learning for clinical natural language processing using siamese neural networks,http://arxiv.org/pdf/2208.14923v2,31/08/2022 16:36,cs.CL,3021,2022
a general-purpose material property data extraction pipeline from large polymer corpora using natural language processing,http://arxiv.org/pdf/2209.13136v1,27/09/2022 04:47,cs.CL,3022,2022
embedding generation for text classification of brazilian portuguese user reviews: from bag-of-words to transformers,http://arxiv.org/pdf/2212.00587v1,01/12/2022 15:24,cs.CL,3023,2022
using natural language processing to predict costume core vocabulary of historical artifacts,http://arxiv.org/pdf/2212.07931v1,24/11/2022 02:13,cs.CL,3025,2022
aspect based sentiment analysis using spectral temporal graph neural network,http://arxiv.org/pdf/2202.06776v1,14/02/2022 14:55,cs.CL,3069,2022
monte carlo tree search for interpreting stress in natural language,http://arxiv.org/pdf/2204.08105v1,18/04/2022 00:06,cs.CL,3070,2022
nlu for game-based learning in real: initial evaluations,http://arxiv.org/pdf/2205.13754v1,27/05/2022 04:48,cs.CL,3071,2022
a novel chinese dialect tts frontend with non-autoregressive neural machine translation,http://arxiv.org/pdf/2206.04922v3,10/06/2022 08:46,cs.CL,3072,2022
a quantum natural language processing approach to pronoun resolution,http://arxiv.org/pdf/2208.05393v1,10/08/2022 16:22,cs.CL,3073,2022
"low-resource end-to-end sanskrit tts using tacotron2, waveglow and transfer learning",http://arxiv.org/pdf/2212.03558v1,07/12/2022 10:15,cs.CL,3074,2022
natural language in requirements engineering for structure inference -- an integrative review,http://arxiv.org/pdf/2202.05065v1,10/02/2022 14:46,cs.CL,3165,2022
bi-directional joint neural networks for intent classification and slot filling,http://arxiv.org/pdf/2202.13079v1,26/02/2022 06:35,cs.CL,3166,2022
hypermixer: an mlp-based low cost alternative to transformers,http://arxiv.org/pdf/2203.03691v2,07/03/2022 20:23,cs.CL,3167,2022
generalized but not robust? comparing the effects of data modification methods on out-of-domain generalization and adversarial robustness,http://arxiv.org/pdf/2203.07653v1,15/03/2022 05:32,cs.CL,3168,2022
domain specific fine-tuning of denoising sequence-to-sequence models for natural language summarization,http://arxiv.org/pdf/2204.09716v1,06/04/2022 19:17,cs.CL,3170,2022
calibration of natural language understanding models with venn--abers predictors,http://arxiv.org/pdf/2205.10586v2,21/05/2022 14:09,cs.CL,3171,2022
innovations in neural data-to-text generation: a survey,http://arxiv.org/pdf/2207.12571v2,26/07/2022 00:21,cs.CL,3172,2022
csl: a large-scale chinese scientific literature dataset,http://arxiv.org/pdf/2209.05034v1,12/09/2022 07:10,cs.CL,3173,2022
prompt combines paraphrase: teaching pre-trained models to understand rare biomedical words,http://arxiv.org/pdf/2209.06453v1,14/09/2022 08:03,cs.CL,3174,2022
learning disentangled representations for natural language definitions,http://arxiv.org/pdf/2210.02898v2,22/09/2022 15:31,cs.CL,3175,2022
prompt conditioned vae: enhancing generative replay for lifelong learning in task-oriented dialogue,http://arxiv.org/pdf/2210.07783v2,14/10/2022 14:12,cs.CL,3176,2022
realistic data augmentation framework for enhancing tabular reasoning,http://arxiv.org/pdf/2210.12795v1,23/10/2022 18:32,cs.CL,3179,2022
the effect of normalization for bi-directional amharic-english neural machine translation,http://arxiv.org/pdf/2210.15224v1,27/10/2022 08:18,cs.CL,3180,2022
programming by example and text-to-code translation for conversational code generation,http://arxiv.org/pdf/2211.11554v3,21/11/2022 15:20,cs.CL,3183,2022
locally typical sampling,http://arxiv.org/pdf/2202.00666v5,01/02/2022 18:58,cs.CL,3237,2022
"lexical simplification benchmarks for english, portuguese, and spanish",http://arxiv.org/pdf/2209.05301v1,12/09/2022 16:06,cs.CL,3241,2022
toward improving health literacy in patient education materials with neural machine translation models,http://arxiv.org/pdf/2209.06723v1,14/09/2022 16:30,cs.CL,3242,2022
spread love not hate: undermining the importance of hateful pre-training for hate speech detection,http://arxiv.org/pdf/2210.04267v3,09/10/2022 14:53,cs.CL,3244,2022
ai-based arabic language and speech tutor,http://arxiv.org/pdf/2210.12346v1,22/10/2022 05:22,cs.CL,3245,2022
"eeny, meeny, miny, moe. how to choose data for morphological inflection",http://arxiv.org/pdf/2210.14465v1,26/10/2022 05:33,cs.CL,3246,2022
sinhala sentence embedding: a two-tiered structure for low-resource languages,http://arxiv.org/pdf/2210.14472v1,26/10/2022 05:46,cs.CL,3247,2022
modeling structure-building in the brain with ccg parsing and large language models,http://arxiv.org/pdf/2210.16147v3,28/10/2022 15:21,cs.CL,3248,2022
"a survey of plagiarism detection systems: case of use with english, french and arabic languages",http://arxiv.org/pdf/2201.03423v1,10/01/2022 16:11,cs.CL,3428,2022
informal persian universal dependency treebank,http://arxiv.org/pdf/2201.03679v1,10/01/2022 22:33,cs.CL,3429,2022
a feature extraction based model for hate speech identification,http://arxiv.org/pdf/2201.04227v1,11/01/2022 22:53,cs.CL,3430,2022
gender bias in text: labeled datasets and lexicons,http://arxiv.org/pdf/2201.08675v2,21/01/2022 12:44,cs.CL,3431,2022
pnlp-mixer: an efficient all-mlp architecture for language,http://arxiv.org/pdf/2202.04350v2,09/02/2022 09:01,cs.CL,3432,2022
a contrastive framework for neural text generation,http://arxiv.org/pdf/2202.06417v3,13/02/2022 21:46,cs.CL,3433,2022
can pre-trained language models interpret similes as smart as human?,http://arxiv.org/pdf/2203.08452v1,16/03/2022 07:57,cs.CL,3434,2022
building robust spoken language understanding by cross attention between phoneme sequence and asr hypothesis,http://arxiv.org/pdf/2203.12067v1,22/03/2022 21:59,cs.CL,3435,2022
probing for labeled dependency trees,http://arxiv.org/pdf/2203.12971v1,24/03/2022 10:21,cs.CL,3436,2022
encbp: a new benchmark dataset for finer-grained cultural background prediction in english,http://arxiv.org/pdf/2203.14498v1,28/03/2022 05:57,cs.CL,3437,2022
auto-mlm: improved contrastive learning for self-supervised multi-lingual knowledge retrieval,http://arxiv.org/pdf/2203.16187v1,30/03/2022 11:13,cs.CL,3438,2022
you are what you write: preserving privacy in the era of large language models,http://arxiv.org/pdf/2204.09391v1,20/04/2022 12:12,cs.CL,3439,2022
syntax-informed question answering with heterogeneous graph transformer,http://arxiv.org/pdf/2204.09655v2,01/04/2022 08:48,cs.CL,3440,2022
cross-lingual word embeddings in hyperbolic space,http://arxiv.org/pdf/2205.01907v2,04/05/2022 07:15,cs.CL,3441,2022
knowledge distillation of russian language models with reduction of vocabulary,http://arxiv.org/pdf/2205.02340v1,04/05/2022 22:56,cs.CL,3442,2022
cats are fuzzy pets: a corpus and analysis of potentially euphemistic terms,http://arxiv.org/pdf/2205.02728v1,05/05/2022 17:01,cs.CL,3443,2022
quantifying synthesis and fusion and their impact on machine translation,http://arxiv.org/pdf/2205.03369v1,06/05/2022 18:04,cs.CL,3444,2022
vector representations of idioms in conversational systems,http://arxiv.org/pdf/2205.03666v1,07/05/2022 15:50,cs.CL,3445,2022
simreluz: similarity and relatedness scores as a semantic evaluation dataset for uzbek language,http://arxiv.org/pdf/2205.06072v1,12/05/2022 14:11,cs.CL,3446,2022
transformers as neural augmentors: class conditional sentence generation via variational bayes,http://arxiv.org/pdf/2205.09391v1,19/05/2022 09:42,cs.CL,3447,2022
exploring extreme parameter compression for pre-trained language models,http://arxiv.org/pdf/2205.10036v1,20/05/2022 10:16,cs.CL,3448,2022
babybear: cheap inference triage for expensive language models,http://arxiv.org/pdf/2205.11747v1,24/05/2022 04:21,cs.CL,3449,2022
sparse*bert: sparse models generalize to new tasks and domains,http://arxiv.org/pdf/2205.12452v3,25/05/2022 03:51,cs.CL,3450,2022
tagprime: a unified framework for relational structure extraction,http://arxiv.org/pdf/2205.12585v2,25/05/2022 09:57,cs.CL,3451,2022
large language models are few-shot clinical information extractors,http://arxiv.org/pdf/2205.12689v2,25/05/2022 12:49,cs.CL,3452,2022
leveraging dependency grammar for fine-grained offensive language detection using graph convolutional networks,http://arxiv.org/pdf/2205.13164v1,26/05/2022 06:27,cs.CL,3453,2022
sscibert: a pre-trained language model for social science texts,http://arxiv.org/pdf/2206.04510v3,09/06/2022 14:49,cs.CL,3454,2022
token is a mask: few-shot named entity recognition with pre-trained language models,http://arxiv.org/pdf/2206.07841v1,15/06/2022 23:49,cs.CL,3455,2022
self-generated in-context learning: leveraging auto-regressive language models as a demonstration generator,http://arxiv.org/pdf/2206.08082v1,16/06/2022 11:52,cs.CL,3456,2022
deep multi-task models for misogyny identification and categorization on arabic social media,http://arxiv.org/pdf/2206.08407v1,16/06/2022 19:54,cs.CL,3457,2022
muboost: an effective method for solving indic multilingual text classification problem,http://arxiv.org/pdf/2206.10280v1,21/06/2022 13:06,cs.CL,3458,2022
text and author-level political inference using heterogeneous knowledge representations,http://arxiv.org/pdf/2206.12293v2,24/06/2022 14:45,cs.CL,3459,2022
towards lexical gender inference: a scalable methodology using online databases,http://arxiv.org/pdf/2206.14055v1,28/06/2022 15:57,cs.CL,3461,2022
building african voices,http://arxiv.org/pdf/2207.00688v1,02/07/2022 00:28,cs.CL,3462,2022
anec: an amharic named entity corpus and transformer based recognizer,http://arxiv.org/pdf/2207.00785v1,02/07/2022 10:50,cs.CL,3463,2022
getting bart to ride the idiomatic train: learning to represent idiomatic expressions,http://arxiv.org/pdf/2207.03679v1,08/07/2022 05:05,cs.CL,3464,2022
myers-briggs personality classification from social media text using pre-trained language models,http://arxiv.org/pdf/2207.04476v1,10/07/2022 15:38,cs.CL,3465,2022
open terminology management and sharing toolkit for federation of terminology databases,http://arxiv.org/pdf/2207.06729v1,14/07/2022 09:27,cs.CL,3466,2022
efficient long-text understanding with short-text models,http://arxiv.org/pdf/2208.00748v3,01/08/2022 12:14,cs.CL,3467,2022
construction of english resume corpus and test with pre-trained language models,http://arxiv.org/pdf/2208.03219v2,05/08/2022 16:07,cs.CL,3469,2022
limitations of language models in arithmetic and symbolic induction,http://arxiv.org/pdf/2208.05051v1,09/08/2022 22:47,cs.CL,3470,2022
on the effectiveness of compact biomedical transformers,http://arxiv.org/pdf/2209.03182v1,07/09/2022 15:24,cs.CL,3472,2022
don't judge a language model by its last layer: contrastive learning with layer-wise attention pooling,http://arxiv.org/pdf/2209.05972v1,13/09/2022 14:09,cs.CL,3474,2022
"comma: modeling relationship among motivations, emotions and actions in language-based human activities",http://arxiv.org/pdf/2209.06470v1,14/09/2022 08:54,cs.CL,3475,2022
an empirical study on cross-x transfer for legal judgment prediction,http://arxiv.org/pdf/2209.12325v1,25/09/2022 22:41,cs.CL,3477,2022
the (in)effectiveness of intermediate task training for domain adaptation and cross-lingual transfer learning,http://arxiv.org/pdf/2210.01091v2,03/10/2022 18:17,cs.CL,3478,2022
word sense induction with hierarchical clustering and mutual information maximization,http://arxiv.org/pdf/2210.05422v1,11/10/2022 14:04,cs.CL,3479,2022
medjex: a medical jargon extraction model with wiki's hyperlink span and contextualized masked language model score,http://arxiv.org/pdf/2210.05875v1,12/10/2022 03:27,cs.CL,3480,2022
annotating norwegian language varieties on twitter for part-of-speech,http://arxiv.org/pdf/2210.06150v1,12/10/2022 13:53,cs.CL,3481,2022
clasp: few-shot cross-lingual data augmentation for semantic parsing,http://arxiv.org/pdf/2210.07074v2,13/10/2022 16:01,cs.CL,3482,2022
watermarking pre-trained language models with backdooring,http://arxiv.org/pdf/2210.07543v2,14/10/2022 06:42,cs.CL,3483,2022
prompting gpt-3 to be reliable,http://arxiv.org/pdf/2210.09150v2,17/10/2022 15:52,cs.CL,3484,2022
safetext: a benchmark for exploring physical safety in language models,http://arxiv.org/pdf/2210.10045v1,18/10/2022 18:59,cs.CL,3485,2022
joint coreference resolution for zeros and non-zeros in arabic,http://arxiv.org/pdf/2210.12169v1,21/10/2022 19:01,cs.CL,3486,2022
enhancing tabular reasoning with pattern exploiting training,http://arxiv.org/pdf/2210.12259v1,21/10/2022 22:28,cs.CL,3487,2022
speeding up question answering task of language models via inverted index,http://arxiv.org/pdf/2210.13578v1,24/10/2022 20:59,cs.CL,3488,2022
smart speech segmentation using acousto-linguistic features with look-ahead,http://arxiv.org/pdf/2210.14446v2,26/10/2022 04:36,cs.CL,3489,2022
leveraging pre-trained models for failure analysis triplets generation,http://arxiv.org/pdf/2210.17497v1,31/10/2022 17:21,cs.CL,3490,2022
multilingual name entity recognition and intent classification employing deep learning architectures,http://arxiv.org/pdf/2211.02415v1,04/11/2022 12:42,cs.CL,3491,2022
a comparison of svm against pre-trained language models (plms) for text classification tasks,http://arxiv.org/pdf/2211.02563v1,04/11/2022 16:28,cs.CL,3492,2022
learning semantic textual similarity via topic-informed discrete latent variables,http://arxiv.org/pdf/2211.03616v1,07/11/2022 15:09,cs.CL,3493,2022
a hybrid entity-centric approach to persian pronoun resolution,http://arxiv.org/pdf/2211.06257v1,11/11/2022 14:59,cs.CL,3494,2022
herdphobia: a dataset for hate speech against fulani in nigeria,http://arxiv.org/pdf/2211.15262v1,28/11/2022 12:30,cs.CL,3497,2022
structured information extraction from complex scientific text with fine-tuned large language models,http://arxiv.org/pdf/2212.05238v1,10/12/2022 07:51,cs.CL,3498,2022
towards reasoning in large language models: a survey,http://arxiv.org/pdf/2212.10403v2,20/12/2022 16:29,cs.CL,3500,2022
a survey on knowledge-enhanced pre-trained language models,http://arxiv.org/pdf/2212.13428v1,27/12/2022 09:54,cs.CL,3501,2022
multilingual text classification for dravidian languages,http://arxiv.org/pdf/2112.01705v1,03/12/2021 04:26,cs.CL,7,2021
supporting undotted arabic with pre-trained language models,http://arxiv.org/pdf/2111.09791v1,18/11/2021 16:47,cs.CL,10,2021
including signed languages in natural language processing,http://arxiv.org/pdf/2105.05222v2,11/05/2021 18:37,cs.CL,12,2021
problems and countermeasures in natural language processing evaluation,http://arxiv.org/pdf/2104.09712v1,20/04/2021 02:35,cs.CL,14,2021
natural language generation using link grammar for general conversational intelligence,http://arxiv.org/pdf/2105.00830v1,19/04/2021 07:16,cs.CL,19,2021
curriculum learning for language modeling,http://arxiv.org/pdf/2108.02170v1,04/08/2021 17:53,cs.CL,23,2021
challenges encountered in turkish natural language processing studies,http://arxiv.org/pdf/2101.11436v1,21/01/2021 08:30,cs.CL,30,2021
cross-lingual adaption model-agnostic meta-learning for natural language understanding,http://arxiv.org/pdf/2111.05805v1,10/11/2021 16:53,cs.CL,39,2021
how commonsense knowledge helps with natural language tasks: a survey of recent resources and methodologies,http://arxiv.org/pdf/2108.04674v1,10/08/2021 14:25,cs.CL,50,2021
large language models are not models of natural language: they are corpus models,http://arxiv.org/pdf/2112.07055v2,13/12/2021 22:39,cs.CL,66,2021
automatic code generation using pre-trained language models,http://arxiv.org/pdf/2102.10535v1,21/02/2021 07:21,cs.CL,71,2021
indian legal nlp benchmarks : a survey,http://arxiv.org/pdf/2107.06056v1,13/07/2021 14:10,cs.CL,95,2021
hinflair: pre-trained contextual string embeddings for pos tagging and text classification in the hindi language,http://arxiv.org/pdf/2101.06949v1,18/01/2021 09:23,cs.CL,110,2021
