Title,PdfUrl,PublishedDate,PrimaryCategory,PaperId,PublishedYear
artificial intelligence (ai) in action: addressing the covid-19 pandemic with natural language processing (nlp),http://arxiv.org/pdf/2010.16413v3,09/10/2020 23:10,cs.CL,3015,2020
semantics-aware inferential network for natural language understanding,http://arxiv.org/pdf/2004.13338v1,28/04/2020 08:24,cs.CL,3037,2020
schubert: optimizing elements of bert,http://arxiv.org/pdf/2005.06628v1,09/05/2020 22:56,cs.CL,3053,2020
natural language qa approaches using reasoning with external knowledge,http://arxiv.org/pdf/2003.03446v1,06/03/2020 21:28,cs.CL,3056,2020
studying attention models in sentiment attitude extraction task,http://arxiv.org/pdf/2006.11605v1,20/06/2020 17:09,cs.CL,3057,2020
roft: a tool for evaluating human detection of machine-generated text,http://arxiv.org/pdf/2010.03070v1,06/10/2020 23:47,cs.CL,3059,2020
improving factual completeness and consistency of image-to-text radiology report generation,http://arxiv.org/pdf/2010.10042v2,20/10/2020 06:42,cs.CL,3060,2020
generating natural language attacks in a hard label black box setting,http://arxiv.org/pdf/2012.14956v2,29/12/2020 22:01,cs.CL,3061,2020
gret: global representation enhanced transformer,http://arxiv.org/pdf/2002.10101v1,24/02/2020 07:37,cs.CL,3120,2020
robust and interpretable grounding of spatial references with relation networks,http://arxiv.org/pdf/2005.00696v2,02/05/2020 05:11,cs.CL,3121,2020
shap values for explaining cnn-based text classification models,http://arxiv.org/pdf/2008.11825v2,26/08/2020 22:28,cs.CL,3122,2020
calibration of pre-trained transformers,http://arxiv.org/pdf/2003.07892v3,17/03/2020 18:58,cs.CL,3135,2020
matching text with deep mutual information estimation,http://arxiv.org/pdf/2003.11521v1,09/03/2020 15:25,cs.CL,3136,2020
evolution of semantic similarity -- a survey,http://arxiv.org/pdf/2004.13820v2,19/04/2020 23:07,cs.CL,3137,2020
multi-branch attentive transformer,http://arxiv.org/pdf/2006.10270v2,18/06/2020 05:24,cs.CL,3139,2020
supervised understanding of word embeddings,http://arxiv.org/pdf/2006.13299v1,23/06/2020 21:13,cs.CL,3140,2020
towards debiasing sentence representations,http://arxiv.org/pdf/2007.08100v1,16/07/2020 05:22,cs.CL,3142,2020
learning to attack: towards textual adversarial attacking in real-world situations,http://arxiv.org/pdf/2009.09192v1,19/09/2020 10:12,cs.CL,3143,2020
docubot : generating financial reports using natural language interactions,http://arxiv.org/pdf/2010.01169v2,02/10/2020 20:06,cs.CL,3144,2020
scene graph modification based on natural language commands,http://arxiv.org/pdf/2010.02591v1,06/10/2020 11:01,cs.CL,3145,2020
inducing alignment structure with gated graph attention networks for sentence matching,http://arxiv.org/pdf/2010.07668v2,15/10/2020 12:25,cs.CL,3146,2020
deep learning for text style transfer: a survey,http://arxiv.org/pdf/2011.00416v5,01/11/2020 04:04,cs.CL,3147,2020
undivided attention: are intermediate layers necessary for bert?,http://arxiv.org/pdf/2012.11881v2,22/12/2020 08:46,cs.CL,3149,2020
r3: a reading comprehension benchmark requiring reasoning processes,http://arxiv.org/pdf/2004.01251v1,02/04/2020 21:39,cs.CL,3207,2020
masakhane -- machine translation for africa,http://arxiv.org/pdf/2003.11529v1,13/03/2020 09:01,cs.CL,3220,2020
on a novel application of wasserstein-procrustes for unsupervised cross-lingual learning,http://arxiv.org/pdf/2007.09456v1,18/07/2020 16:35,cs.CL,3223,2020
"development of a dataset and a deep learning baseline named entity recognizer for three low resource languages: bhojpuri, maithili and magahi",http://arxiv.org/pdf/2009.06451v1,14/09/2020 15:07,cs.CL,3225,2020
on the effects of using word2vec representations in neural networks for dialogue act recognition,http://arxiv.org/pdf/2010.11490v1,22/10/2020 08:21,cs.CL,3226,2020
gottbert: a pure german language model,http://arxiv.org/pdf/2012.02110v1,03/12/2020 17:45,cs.CL,3227,2020
disentangling homophemes in lip reading using perplexity analysis,http://arxiv.org/pdf/2012.07528v1,28/11/2020 12:12,cs.CL,3228,2020
improving spoken language understanding by exploiting asr n-best hypotheses,http://arxiv.org/pdf/2001.05284v1,11/01/2020 05:48,cs.CL,3328,2020
araacom: arabic algerian corpus for opinion mining,http://arxiv.org/pdf/2001.08010v1,22/01/2020 13:45,cs.CL,3329,2020
uit-viic: a dataset for the first evaluation on vietnamese image captioning,http://arxiv.org/pdf/2002.00175v1,01/02/2020 09:26,cs.CL,3330,2020
fquad: french question answering dataset,http://arxiv.org/pdf/2002.06071v2,14/02/2020 15:23,cs.CL,3331,2020
lxper index: a curriculum-specific text readability assessment model for efl students in korea,http://arxiv.org/pdf/2008.01564v1,01/08/2020 12:55,cs.CL,3333,2020
the impact of indirect machine translation on sentiment classification,http://arxiv.org/pdf/2008.11257v1,25/08/2020 21:30,cs.CL,3334,2020
beheshti-ner: persian named entity recognition using bert,http://arxiv.org/pdf/2003.08875v1,19/03/2020 15:55,cs.CL,3348,2020
improving yorb diacritic restoration,http://arxiv.org/pdf/2003.10564v1,23/03/2020 22:07,cs.CL,3349,2020
understanding linearity of cross-lingual word embedding mappings,http://arxiv.org/pdf/2004.01079v3,02/04/2020 16:40,cs.CL,3350,2020
downstream model design of pre-trained language model for relation extraction task,http://arxiv.org/pdf/2004.03786v1,08/04/2020 04:16,cs.CL,3352,2020
xtremedistil: multi-stage distillation for massive multilingual models,http://arxiv.org/pdf/2004.05686v2,12/04/2020 20:49,cs.CL,3353,2020
an effective contextual language modeling framework for speech summarization with augmented features,http://arxiv.org/pdf/2006.01189v1,01/06/2020 19:27,cs.CL,3356,2020
declutr: deep contrastive learning for unsupervised textual representations,http://arxiv.org/pdf/2006.03659v4,05/06/2020 21:00,cs.CL,3357,2020
text data augmentation: towards better detection of spear-phishing emails,http://arxiv.org/pdf/2007.02033v2,04/07/2020 08:45,cs.CL,3358,2020
multi-dialect arabic bert for country-level dialect identification,http://arxiv.org/pdf/2007.05612v1,10/07/2020 22:11,cs.CL,3359,2020
exploring swedish & english fasttext embeddings for ner with the transformer,http://arxiv.org/pdf/2007.16007v2,23/07/2020 09:51,cs.CL,3360,2020
intent detection with wikihow,http://arxiv.org/pdf/2009.05781v2,12/09/2020 13:53,cs.CL,3362,2020
real-time execution of large-scale language models on mobile,http://arxiv.org/pdf/2009.06823v2,15/09/2020 02:59,cs.CL,3363,2020
anchibert: a pre-trained model for ancient chineselanguage understanding and generation,http://arxiv.org/pdf/2009.11473v2,24/09/2020 04:41,cs.CL,3364,2020
what disease does this patient have? a large-scale open domain question answering dataset from medical exams,http://arxiv.org/pdf/2009.13081v1,28/09/2020 06:07,cs.CL,3365,2020
generative latent neural models for automatic word alignment,http://arxiv.org/pdf/2009.13117v1,28/09/2020 08:54,cs.CL,3366,2020
an empirical investigation towards efficient multi-domain language model pre-training,http://arxiv.org/pdf/2010.00784v1,01/10/2020 10:20,cs.CL,3368,2020
cross-lingual transfer learning for complex word identification,http://arxiv.org/pdf/2010.01108v1,02/10/2020 18:09,cs.CL,3369,2020
generalizable and explainable dialogue generation via explicit action learning,http://arxiv.org/pdf/2010.03755v1,08/10/2020 05:37,cs.CL,3370,2020
load what you need: smaller versions of multilingual bert,http://arxiv.org/pdf/2010.05609v1,12/10/2020 12:29,cs.CL,3371,2020
an investigation on different underlying quantization schemes for pre-trained language models,http://arxiv.org/pdf/2010.07109v1,14/10/2020 15:05,cs.CL,3372,2020
fine-tuning pre-trained language model with weak supervision: a contrastive-regularized self-training approach,http://arxiv.org/pdf/2010.07835v3,15/10/2020 16:55,cs.CL,3373,2020
pysbd: pragmatic sentence boundary disambiguation,http://arxiv.org/pdf/2010.09657v1,19/10/2020 17:56,cs.CL,3374,2020
tweeteval: unified benchmark and comparative evaluation for tweet classification,http://arxiv.org/pdf/2010.12421v2,23/10/2020 15:11,cs.CL,3375,2020
biomedical named entity recognition at scale,http://arxiv.org/pdf/2011.06315v1,12/11/2020 11:10,cs.CL,3376,2020
mvp-bert: redesigning vocabularies for chinese bert and multi-vocab pretraining,http://arxiv.org/pdf/2011.08539v1,17/11/2020 10:15,cs.CL,3377,2020
do fine-tuned commonsense language models really generalize?,http://arxiv.org/pdf/2011.09159v1,18/11/2020 08:52,cs.CL,3378,2020
slurp: a spoken language understanding resource package,http://arxiv.org/pdf/2011.13205v1,26/11/2020 09:58,cs.CL,3379,2020
multimodal pretraining unmasked: a meta-analysis and a unified framework of vision-and-language berts,http://arxiv.org/pdf/2011.15124v2,30/11/2020 18:55,cs.CL,3380,2020
thamizhiudp: a dependency parser for tamil,http://arxiv.org/pdf/2012.13436v1,24/12/2020 20:20,cs.CL,3382,2020
simple natural language processing tools for danish,http://arxiv.org/pdf/1906.11608v2,27/06/2019 14:15,cs.CL,2,2019
deploying technology to save endangered languages,http://arxiv.org/pdf/1908.08971v2,23/08/2019 19:31,cs.CL,6,2019
language tasks and language games: on methodology in current natural language processing research,http://arxiv.org/pdf/1908.10747v1,28/08/2019 15:29,cs.CL,20,2019
thoth: improved rapid serial visual presentation using natural language processing,http://arxiv.org/pdf/1908.01699v1,05/08/2019 16:45,cs.CL,26,2019
development of deep learning based natural language processing model for turkish,http://arxiv.org/pdf/1905.05699v1,07/05/2019 22:09,cs.CL,34,2019
gancoder: an automatic natural language-to-programming language translation approach based on gan,http://arxiv.org/pdf/1912.00609v1,02/12/2019 07:41,cs.CL,38,2019
incrementalizing rasa's open-source natural language understanding pipeline,http://arxiv.org/pdf/1907.05403v1,11/07/2019 18:35,cs.CL,49,2019
evaluating computational language models with scaling properties of natural language,http://arxiv.org/pdf/1906.09379v1,22/06/2019 04:24,cs.CL,51,2019
hierarchical representation in neural language models: suppression and recovery of expectations,http://arxiv.org/pdf/1906.04068v1,10/06/2019 16:20,cs.CL,96,2019
xlda: cross-lingual data augmentation for natural language inference and question answering,http://arxiv.org/pdf/1905.11471v1,27/05/2019 20:44,cs.CL,101,2019
syllable-based neural named entity recognition for myanmar language,http://arxiv.org/pdf/1903.04739v1,12/03/2019 05:52,cs.CL,106,2019
from textual information sources to linked data in the agatha project,http://arxiv.org/pdf/1909.05359v1,03/09/2019 09:27,cs.CL,123,2019
emergence of numeric concepts in multi-agent autonomous communication,http://arxiv.org/pdf/1911.01098v1,04/11/2019 09:58,cs.CL,141,2019
error analysis for vietnamese dependency parsing,http://arxiv.org/pdf/1911.03724v1,09/11/2019 16:00,cs.CL,161,2019
a novel task-oriented text corpus in silent speech recognition and its natural language generation construction method,http://arxiv.org/pdf/1905.01974v1,19/04/2019 09:21,cs.CL,189,2019
exploring language similarities with dimensionality reduction technique,http://arxiv.org/pdf/1902.06092v1,16/02/2019 11:27,cs.CL,193,2019
evolution of transfer learning in natural language processing,http://arxiv.org/pdf/1910.07370v1,16/10/2019 15:24,cs.CL,206,2019
alter: auxiliary text rewriting tool for natural language generation,http://arxiv.org/pdf/1909.06564v1,14/09/2019 10:18,cs.CL,218,2019
visualizing rnn states with predictive semantic encodings,http://arxiv.org/pdf/1908.00588v1,01/08/2019 20:24,cs.CL,221,2019
fine-grained sentiment classification using bert,http://arxiv.org/pdf/1910.03474v1,04/10/2019 10:20,cs.CL,228,2019
a holistic natural language generation framework for the semantic web,http://arxiv.org/pdf/1911.01248v1,04/11/2019 14:35,cs.CL,290,2019
is multilingual bert fluent in language generation?,http://arxiv.org/pdf/1910.03806v1,09/10/2019 07:35,cs.CL,313,2019
a subword level language model for bangla language,http://arxiv.org/pdf/1911.07613v1,15/11/2019 08:22,cs.CL,315,2019
make up your mind! adversarial generation of inconsistent natural language explanations,http://arxiv.org/pdf/1910.03065v3,07/10/2019 21:14,cs.CL,327,2019
a survey of code-switched speech and language processing,http://arxiv.org/pdf/1904.00784v3,25/03/2019 14:36,cs.CL,335,2019
bootstrapping method for developing part-of-speech tagged corpus in low resource languages tagset - a focus on an african igbo,http://arxiv.org/pdf/1903.05225v1,12/03/2019 21:24,cs.CL,359,2019
scispacy: fast and robust models for biomedical natural language processing,http://arxiv.org/pdf/1902.07669v3,20/02/2019 17:28,cs.CL,361,2019
getting gender right in neural machine translation,http://arxiv.org/pdf/1909.05088v1,11/09/2019 15:44,cs.CL,362,2019
neural cross-lingual relation extraction based on bilingual word embedding mapping,http://arxiv.org/pdf/1911.00069v1,31/10/2019 19:30,cs.CL,373,2019
word-order biases in deep-agent emergent communication,http://arxiv.org/pdf/1905.12330v3,29/05/2019 12:17,cs.CL,386,2019
surf at mediqa 2019: improving performance of natural language inference in the clinical domain by adopting pre-trained language model,http://arxiv.org/pdf/1906.07854v1,19/06/2019 01:13,cs.CL,389,2019
contextual text denoising with masked language models,http://arxiv.org/pdf/1910.14080v1,30/10/2019 18:47,cs.CL,401,2019
towards realistic practices in low-resource natural language processing: the development set,http://arxiv.org/pdf/1909.01522v2,04/09/2019 03:20,cs.CL,412,2019
a survey on neural network language models,http://arxiv.org/pdf/1906.03591v2,09/06/2019 09:15,cs.CL,454,2019
subword elmo,http://arxiv.org/pdf/1909.08357v1,18/09/2019 12:14,cs.CL,455,2019
delta: a deep learning based language technology platform,http://arxiv.org/pdf/1908.01853v1,02/08/2019 02:13,cs.CL,489,2019
sumqe: a bert-based summary quality estimation model,http://arxiv.org/pdf/1909.00578v1,02/09/2019 08:30,cs.CL,504,2019
using natural language processing to develop an automated orthodontic diagnostic system,http://arxiv.org/pdf/1905.13601v1,31/05/2019 14:13,cs.CL,522,2019
ouroboros: on accelerating training of transformer-based language models,http://arxiv.org/pdf/1909.06695v1,15/09/2019 00:21,cs.CL,545,2019
language comparison via network topology,http://arxiv.org/pdf/1907.06944v2,16/07/2019 12:33,cs.CL,561,2019
cross-lingual transfer for distantly supervised and low-resources indonesian ner,http://arxiv.org/pdf/1907.11158v1,25/07/2019 17:04,cs.CL,562,2019
gendered pronoun resolution using bert and an extractive question answering formulation,http://arxiv.org/pdf/1906.03695v1,09/06/2019 20:25,cs.CL,659,2019
"a survey of natural language generation techniques with a focus on dialogue systems - past, present and future directions",http://arxiv.org/pdf/1906.00500v1,02/06/2019 23:55,cs.CL,666,2019
adversarial language games for advanced natural language intelligence,http://arxiv.org/pdf/1911.01622v4,05/11/2019 05:14,cs.CL,669,2019
semi-supervised neural text generation by joint learning of natural language generation and natural language understanding models,http://arxiv.org/pdf/1910.03484v1,29/09/2019 12:37,cs.CL,678,2019
camembert: a tasty french language model,http://arxiv.org/pdf/1911.03894v3,10/11/2019 10:46,cs.CL,708,2019
survey on publicly available sinhala natural language processing tools and research,http://arxiv.org/pdf/1906.02358v20,06/06/2019 00:36,cs.CL,723,2019
polylingual wordnet,http://arxiv.org/pdf/1903.01411v1,04/03/2019 18:10,cs.CL,725,2019
cfo: a framework for building production nlp systems,http://arxiv.org/pdf/1908.06121v3,16/08/2019 19:19,cs.CL,737,2019
a multi-cascaded deep model for bilingual sms classification,http://arxiv.org/pdf/1911.13066v1,29/11/2019 11:35,cs.CL,754,2019
a review of automated speech and language features for assessment of cognitive and thought disorders,http://arxiv.org/pdf/1906.01157v2,04/06/2019 03:17,cs.CL,790,2019
human-like machine thinking: language guided imagination,http://arxiv.org/pdf/1905.07562v2,18/05/2019 10:23,cs.CL,799,2019
korquad1.0: korean qa dataset for machine reading comprehension,http://arxiv.org/pdf/1909.07005v2,16/09/2019 07:15,cs.CL,812,2019
chinese word segmentation: another decade review (2007-2017),http://arxiv.org/pdf/1901.06079v1,18/01/2019 04:16,cs.CL,816,2019
adaptive artificial intelligent q&a platform,http://arxiv.org/pdf/1902.02162v1,19/01/2019 17:40,cs.CL,817,2019
pre-learning environment representations for data-efficient neural instruction following,http://arxiv.org/pdf/1907.09671v1,23/07/2019 04:11,cs.CL,850,2019
does bert agree? evaluating knowledge of structure dependence through agreement relations,http://arxiv.org/pdf/1908.09892v1,26/08/2019 20:56,cs.CL,851,2019
low-dimensional semantic space: from text to word embedding,http://arxiv.org/pdf/1911.00845v1,03/11/2019 07:11,cs.CL,852,2019
un systeme de lemmatisation pour les applications de taln,http://arxiv.org/pdf/1911.03922v2,10/11/2019 12:53,cs.CL,853,2019
meemi: a simple method for post-processing and integrating cross-lingual word embeddings,http://arxiv.org/pdf/1910.07221v4,16/10/2019 09:59,cs.CL,871,2019
choosing transfer languages for cross-lingual learning,http://arxiv.org/pdf/1905.12688v2,29/05/2019 20:19,cs.CL,874,2019
evaluating word embedding models: methods and experimental results,http://arxiv.org/pdf/1901.09785v2,28/01/2019 16:33,cs.CL,891,2019
interpreting and improving natural-language processing (in machines) with natural language-processing (in the brain),http://arxiv.org/pdf/1905.11833v4,28/05/2019 15:13,cs.CL,901,2019
distilling task-specific knowledge from bert into simple neural networks,http://arxiv.org/pdf/1903.12136v1,28/03/2019 17:23,cs.CL,905,2019
categorization in the wild: generalizing cognitive models to naturalistic data across languages,http://arxiv.org/pdf/1902.08830v1,23/02/2019 19:21,cs.CL,906,2019
bert for joint intent classification and slot filling,http://arxiv.org/pdf/1902.10909v1,28/02/2019 05:54,cs.CL,933,2019
automated email generation for targeted attacks using natural language,http://arxiv.org/pdf/1908.06893v1,19/08/2019 16:52,cs.CL,936,2019
to lemmatize or not to lemmatize: how word normalisation affects elmo performance in word sense disambiguation,http://arxiv.org/pdf/1909.03135v1,06/09/2019 22:49,cs.CL,972,2019
pretrained language models for sequential sentence classification,http://arxiv.org/pdf/1909.04054v2,09/09/2019 19:00,cs.CL,973,2019
asu at textgraphs shared task: explanation regeneration using language models and iterative re-ranking,http://arxiv.org/pdf/1909.08863v1,19/09/2019 09:47,cs.CL,974,2019
measuring conceptual entanglement in collections of documents,http://arxiv.org/pdf/1909.09708v1,20/09/2019 21:22,cs.CL,975,2019
linguistic generalization and compositionality in modern artificial neural networks,http://arxiv.org/pdf/1904.00157v3,30/03/2019 06:48,cs.CL,979,2019
from the token to the review: a hierarchical multimodal approach to opinion mining,http://arxiv.org/pdf/1908.11216v3,29/08/2019 14:34,cs.CL,980,2019
smaller text classifiers with discriminative cluster embeddings,http://arxiv.org/pdf/1906.09532v1,23/06/2019 03:00,cs.CL,1023,2019
neural networks as explicit word-based rules,http://arxiv.org/pdf/1907.04613v1,10/07/2019 11:50,cs.CL,1026,2019
supervised contextual embeddings for transfer learning in natural language processing tasks,http://arxiv.org/pdf/1906.12039v1,28/06/2019 05:41,cs.CL,1035,2019
multi-turn inference matching network for natural language inference,http://arxiv.org/pdf/1901.02222v1,08/01/2019 09:48,cs.CL,1038,2019
geosqa: a benchmark for scenario-based question answering in the geography domain at high school level,http://arxiv.org/pdf/1908.07855v1,20/08/2019 16:11,cs.CL,1042,2019
converse attention knowledge transfer for low-resource named entity recognition,http://arxiv.org/pdf/1906.01183v4,04/06/2019 04:33,cs.CL,1065,2019
theoretical limitations of self-attention in neural sequence models,http://arxiv.org/pdf/1906.06755v2,16/06/2019 20:19,cs.CL,1079,2019
reverse transfer learning: can word embeddings trained for different nlp tasks improve neural language models?,http://arxiv.org/pdf/1909.04130v1,09/09/2019 21:01,cs.CL,1101,2019
mapping supervised bilingual word embeddings from english to low-resource languages,http://arxiv.org/pdf/1910.06411v1,14/10/2019 21:32,cs.CL,1102,2019
a neural document language modeling framework for spoken document retrieval,http://arxiv.org/pdf/1910.14286v1,31/10/2019 07:50,cs.CL,1103,2019
pidginunmt: unsupervised neural machine translation from west african pidgin to english,http://arxiv.org/pdf/1912.03444v1,07/12/2019 05:30,cs.CL,1106,2019
rare words: a major problem for contextualized embeddings and how to fix it by attentive mimicking,http://arxiv.org/pdf/1904.06707v4,14/04/2019 16:26,cs.CL,1113,2019
adapt or get left behind: domain adaptation through bert language model finetuning for aspect-target sentiment classification,http://arxiv.org/pdf/1908.11860v2,30/08/2019 18:44,cs.CL,1114,2019
improving pre-trained multilingual models with vocabulary expansion,http://arxiv.org/pdf/1909.12440v1,27/09/2019 00:56,cs.CL,1193,2019
bas: an answer selection method using bert language model,http://arxiv.org/pdf/1911.01528v4,04/11/2019 23:16,cs.CL,1196,2019
incremental processing of noisy user utterances in the spoken language understanding task,http://arxiv.org/pdf/1909.13790v1,30/09/2019 16:35,cs.CL,1242,2019
rnn based incremental online spoken language understanding,http://arxiv.org/pdf/1910.10287v2,23/10/2019 01:17,cs.CL,1268,2019
an annotated corpus of reference resolution for interpreting common grounding,http://arxiv.org/pdf/1911.07588v1,18/11/2019 12:41,cs.CL,1272,2019
improving sequence modeling ability of recurrent neural networks via sememes,http://arxiv.org/pdf/1910.08910v2,20/10/2019 07:43,cs.CL,1282,2019
leveraging sentence similarity in natural language generation: improving beam search using range voting,http://arxiv.org/pdf/1908.06288v2,17/08/2019 11:36,cs.CL,1304,2019
can a gorilla ride a camel? learning semantic plausibility from text,http://arxiv.org/pdf/1911.05689v1,13/11/2019 18:13,cs.CL,1305,2019
sparse associative memory based on contextual code learning for disambiguating word senses,http://arxiv.org/pdf/1911.06415v1,14/11/2019 23:31,cs.CL,1306,2019
ernie: enhanced representation through knowledge integration,http://arxiv.org/pdf/1904.09223v1,19/04/2019 16:10,cs.CL,1329,2019
from the paft to the fiiture: a fully automatic nmt and word embeddings method for ocr post-correction,http://arxiv.org/pdf/1910.05535v1,12/10/2019 10:23,cs.CL,1345,2019
real-time claim detection from news articles and retrieval of semantically-similar factchecks,http://arxiv.org/pdf/1907.02030v1,03/07/2019 17:50,cs.CL,1346,2019
transfer fine-tuning: a bert case study,http://arxiv.org/pdf/1909.00931v1,03/09/2019 04:06,cs.CL,1353,2019
an augmented transformer architecture for natural language generation tasks,http://arxiv.org/pdf/1910.13634v1,30/10/2019 02:46,cs.CL,1354,2019
from web crawled text to project descriptions: automatic summarizing of social innovation projects,http://arxiv.org/pdf/1905.09086v1,22/05/2019 12:49,cs.CL,1360,2019
discourse marker augmented network with reinforcement learning for natural language inference,http://arxiv.org/pdf/1907.09692v1,23/07/2019 05:27,cs.CL,1366,2019
generalizing natural language analysis through span-relation representations,http://arxiv.org/pdf/1911.03822v2,10/11/2019 01:42,cs.CL,1367,2019
women in isis propaganda: a natural language processing analysis of topics and emotions in a comparison with mainstream religious group,http://arxiv.org/pdf/1912.03804v1,09/12/2019 01:11,cs.CL,1435,2019
explicit sparse transformer: concentrated attention through explicit selection,http://arxiv.org/pdf/1912.11637v1,25/12/2019 10:59,cs.CL,1436,2019
self-knowledge distillation in natural language processing,http://arxiv.org/pdf/1908.01851v1,02/08/2019 16:17,cs.CL,1442,2019
detect camouflaged spam content via stoneskipping: graph and text joint embedding for chinese character variation representation,http://arxiv.org/pdf/1908.11561v1,30/08/2019 07:38,cs.CL,1443,2019
hauwe: hausa words embedding for natural language processing,http://arxiv.org/pdf/1911.10708v1,25/11/2019 05:46,cs.CL,1444,2019
annotating student talk in text-based classroom discussions,http://arxiv.org/pdf/1909.03023v1,06/09/2019 18:18,cs.CL,1499,2019
learning conceptual-contextual embeddings for medical text,http://arxiv.org/pdf/1908.06203v3,17/08/2019 00:27,cs.CL,1504,2019
nefnir: a high accuracy lemmatizer for icelandic,http://arxiv.org/pdf/1907.11907v1,27/07/2019 14:30,cs.CL,1544,2019
normalyzing numeronyms -- a nlp approach,http://arxiv.org/pdf/1907.13356v2,31/07/2019 08:53,cs.CL,1545,2019
"calibration, entropy rates, and memory in language models",http://arxiv.org/pdf/1906.05664v1,11/06/2019 18:00,cs.CL,1576,2019
named entity recognition system for sindhi language,http://arxiv.org/pdf/1910.03475v1,28/09/2019 08:45,cs.CL,1577,2019
perturbation sensitivity analysis to detect unintended model biases,http://arxiv.org/pdf/1910.04210v1,09/10/2019 20:25,cs.CL,1578,2019
automatic creation of text corpora for low-resource languages from the internet: the case of swiss german,http://arxiv.org/pdf/1912.00159v3,30/11/2019 08:42,cs.CL,1587,2019
a comparison of architectures and pretraining methods for contextualized multilingual word embeddings,http://arxiv.org/pdf/1912.10169v1,15/12/2019 11:42,cs.CL,1589,2019
"don't paraphrase, detect! rapid and effective data collection for semantic parsing",http://arxiv.org/pdf/1908.09940v2,26/08/2019 23:15,cs.CL,1595,2019
simplebooks: long-term dependency book dataset with simplified english vocabulary for word-level language modeling,http://arxiv.org/pdf/1911.12391v1,27/11/2019 19:37,cs.CL,1596,2019
