Title,PdfUrl,PublishedDate,PrimaryCategory,PaperId,PublishedYear
wikipedia-based semantic interpretation for natural language processing,http://arxiv.org/pdf/1401.5697v1,15/01/2014 05:21,cs.CL,494,2014
exploiting diversity in natural language processing: combining parsers,http://arxiv.org/pdf/cs/0006003v1,01/06/2000 19:42,cs.CL,516,2000
posterior calibration and exploratory analysis for natural language processing models,http://arxiv.org/pdf/1508.05154v2,21/08/2015 01:25,cs.CL,518,2015
resolution of verb ellipsis in japanese sentence using surface expressions and examples,http://arxiv.org/pdf/cs/9912006v1,13/12/1999 05:19,cs.CL,537,1999
on the development of text input method - lessons learned,http://arxiv.org/pdf/0704.3665v1,27/04/2007 06:58,cs.CL,538,2007
a literature review: stemming algorithms for indian languages,http://arxiv.org/pdf/1308.5423v1,25/08/2013 17:41,cs.CL,539,2013
sign language lexical recognition with propositional dynamic logic,http://arxiv.org/pdf/1403.6636v1,26/03/2014 11:47,cs.CL,560,2014
clustering algorithm for gujarati language,http://arxiv.org/pdf/1307.5393v1,20/07/2013 10:05,cs.CL,594,2013
the delivermath project - text analysis in mathematics,http://arxiv.org/pdf/1306.6944v1,07/06/2013 16:48,cs.CL,598,2013
a multilingual framenet-based grammar and lexicon for controlled natural language,http://arxiv.org/pdf/1511.03924v1,12/11/2015 15:23,cs.CL,609,2015
unsupervised language acquisition: theory and practice,http://arxiv.org/pdf/cs/0212024v1,10/12/2002 21:59,cs.CL,667,2002
towards the rapid development of a natural language understanding module,http://arxiv.org/pdf/1302.1380v1,06/02/2013 14:17,cs.CL,676,2013
a rhetorical analysis approach to natural language processing,http://arxiv.org/pdf/1301.3547v1,16/01/2013 01:42,cs.CL,700,2013
a tableaux calculus for ambiguous quantification,http://arxiv.org/pdf/cs/0009015v1,20/09/2000 14:23,cs.CL,703,2000
probabilistic modelling of morphologically rich languages,http://arxiv.org/pdf/1508.04271v1,18/08/2015 11:29,cs.CL,797,2015
learning transformation rules to find grammatical relations,http://arxiv.org/pdf/cs/9906015v1,14/06/1999 23:06,cs.CL,805,1999
semantic robust parsing for noun extraction from natural language queries,http://arxiv.org/pdf/cs/9909002v1,02/09/1999 16:53,cs.CL,806,1999
mixed-level knowledge representation and variable-depth inference in natural language processing,http://arxiv.org/pdf/cs/9912017v1,23/12/1999 15:48,cs.CL,807,1999
a tableau calculus for pronoun resolution,http://arxiv.org/pdf/cs/0009017v1,21/09/2000 15:49,cs.CL,808,2000
natural language feature selection via cooccurrence,http://arxiv.org/pdf/1403.2004v1,08/03/2014 20:10,cs.CL,809,2014
bayesian information extraction network,http://arxiv.org/pdf/cs/0306039v1,10/06/2003 05:40,cs.CL,833,2003
a resource-based korean morphological annotation system,http://arxiv.org/pdf/0711.3453v1,21/11/2007 20:41,cs.CL,839,2007
a lexical analysis tool with ambiguity support,http://arxiv.org/pdf/1202.6583v1,29/02/2012 15:59,cs.CL,840,2012
an hmm based named entity recognition system for indian languages: the ju system at icon,http://arxiv.org/pdf/1405.7397v1,28/05/2014 22:05,cs.CL,841,2014
"un rsumeur  base de graphes, indpndant de la langue",http://arxiv.org/pdf/1501.01243v1,06/01/2015 17:27,cs.CL,842,2015
ask me anything: dynamic memory networks for natural language processing,http://arxiv.org/pdf/1506.07285v5,24/06/2015 09:27,cs.CL,889,2015
generating natural language descriptions from owl ontologies: the naturalowl system,http://arxiv.org/pdf/1405.6164v1,24/04/2014 03:47,cs.CL,929,2014
japanese-spanish thesaurus construction using english as a pivot,http://arxiv.org/pdf/1303.1232v1,06/03/2013 01:30,cs.CL,970,2013
development of a hindi lemmatizer,http://arxiv.org/pdf/1305.6211v2,24/05/2013 19:01,cs.CL,971,2013
learning in the rational speech acts model,http://arxiv.org/pdf/1510.06807v1,23/10/2015 03:24,cs.CL,978,2015
robust dialogue understanding in herald,http://arxiv.org/pdf/cs/0410058v1,23/10/2004 00:41,cs.CL,1000,2004
effects of language modeling on speech-driven question answering,http://arxiv.org/pdf/cs/0407028v1,10/07/2004 12:57,cs.CL,1075,2004
acronym recognition and processing in languages,http://arxiv.org/pdf/1309.6185v1,24/09/2013 15:41,cs.CL,1076,2013
computerization of african languages-french dictionaries,http://arxiv.org/pdf/1405.5893v1,22/05/2014 21:15,cs.CL,1077,2014
analyzing the language of food on social media,http://arxiv.org/pdf/1409.2195v2,08/09/2014 04:07,cs.CL,1095,2014
polarity detection movie reviews in hindi language,http://arxiv.org/pdf/1409.3942v1,13/09/2014 13:36,cs.CL,1096,2014
the quantum challenge in concept theory and natural language processing,http://arxiv.org/pdf/1306.2838v1,12/06/2013 15:35,cs.CL,1210,2013
forgetting exceptions is harmful in language learning,http://arxiv.org/pdf/cs/9812021v1,22/12/1998 16:33,cs.CL,1222,1998
cross-lingual keyword assignment,http://arxiv.org/pdf/cs/0609061v1,12/09/2006 10:29,cs.CL,1229,2006
improving the performance of english-tamil statistical machine translation system using source-side pre-processing,http://arxiv.org/pdf/1409.8581v1,29/09/2014 05:54,cs.CL,1240,2014
open system categorical quantum semantics in natural language processing,http://arxiv.org/pdf/1502.00831v2,03/02/2015 12:16,cs.CL,1289,2015
a cognitive neural architecture able to learn and communicate through natural language,http://arxiv.org/pdf/1506.03229v3,10/06/2015 10:25,cs.CL,1293,2015
on the entropy of written spanish,http://arxiv.org/pdf/0901.4784v1,30/01/2009 03:46,cs.CL,1297,2009
text segmentation with character-level text embeddings,http://arxiv.org/pdf/1309.4628v1,18/09/2013 13:38,cs.CL,1328,2013
contrastive unsupervised word alignment with non-local features,http://arxiv.org/pdf/1410.2082v2,08/10/2014 13:24,cs.CL,1348,2014
voice based self help system: user experience vs accuracy,http://arxiv.org/pdf/1504.01496v1,07/04/2015 08:02,cs.CL,1417,2015
combining independent modules to solve multiple-choice synonym and analogy problems,http://arxiv.org/pdf/cs/0309035v1,19/09/2003 21:13,cs.CL,1422,2003
let's get the student into the driver's seat,http://arxiv.org/pdf/0711.3726v1,23/11/2007 13:44,cs.CL,1424,2007
machine learning of phonologically conditioned noun declensions for tamil morphological generators,http://arxiv.org/pdf/1402.3382v1,14/02/2014 06:46,cs.CL,1425,2014
cbas: context based arabic stemmer,http://arxiv.org/pdf/1611.00027v1,28/10/2015 10:10,cs.CL,1428,2015
turn segmentation into utterances for arabic spontaneous dialogues and instance messages,http://arxiv.org/pdf/1505.03081v1,12/05/2015 17:33,cs.CL,1431,2015
developing a new approach for arabic morphological analysis and generation,http://arxiv.org/pdf/1101.5494v1,28/01/2011 09:58,cs.CL,1497,2011
hmm specialization with selective lexicalization,http://arxiv.org/pdf/cs/9912016v1,23/12/1999 01:07,cs.CL,1526,1999
generating models for temporal representations,http://arxiv.org/pdf/0710.2852v1,15/10/2007 16:45,cs.CL,1528,2007
constructions dfinitoires des tables du lexique-grammaire,http://arxiv.org/pdf/1009.1117v2,06/09/2010 19:35,cs.CL,1529,2010
a simple and efficient method to generate word sense representations,http://arxiv.org/pdf/1412.6045v2,18/12/2014 20:14,cs.CL,1530,2014
cross-language information retrieval for technical documents,http://arxiv.org/pdf/cs/9907007v2,06/07/1999 17:25,cs.CL,1570,1999
an algorithm for aligning sentences in bilingual corpora using lexical information,http://arxiv.org/pdf/cs/0302014v1,12/02/2003 06:31,cs.CL,1571,2003
automatic identification of document translations in large multilingual document collections,http://arxiv.org/pdf/cs/0609060v1,12/09/2006 09:44,cs.CL,1572,2006
cross-language personal name mapping,http://arxiv.org/pdf/1405.6293v1,24/05/2014 12:39,cs.CL,1574,2014
bengali to assamese statistical machine translation using moses (corpus based),http://arxiv.org/pdf/1504.01182v1,06/04/2015 02:18,cs.CL,1665,2015
multilingual language processing from bytes,http://arxiv.org/pdf/1512.00103v2,01/12/2015 00:23,cs.CL,1666,2015
lexpresso: a controlled natural language,http://arxiv.org/pdf/1407.1933v1,08/07/2014 03:53,cs.CL,1705,2014
a tutorial on dual decomposition and lagrangian relaxation for inference in natural language processing,http://arxiv.org/pdf/1405.5208v1,23/01/2014 02:50,cs.CL,1709,2014
an approach to reducing annotation costs for bionlp,http://arxiv.org/pdf/1409.3881v1,12/09/2014 23:40,cs.CL,1710,2014
natural language processing - a survey,http://arxiv.org/pdf/1209.6238v1,25/09/2012 22:05,cs.CL,1787,2012
nile: fast natural language processing for electronic health records,http://arxiv.org/pdf/1311.6063v5,23/11/2013 22:39,cs.CL,1788,2013
natural language processing in biomedicine: a unified system architecture overview,http://arxiv.org/pdf/1401.0569v2,03/01/2014 00:57,cs.CL,1789,2014
analysis of named entity recognition and linking for tweets,http://arxiv.org/pdf/1410.7182v1,27/10/2014 11:09,cs.CL,1790,2014
learning structural kernels for natural language processing,http://arxiv.org/pdf/1508.02131v1,10/08/2015 06:57,cs.CL,1791,2015
overview of stemming algorithms for indian and non-indian languages,http://arxiv.org/pdf/1404.2878v1,10/04/2014 18:16,cs.CL,1831,2014
distributed representations for compositional semantics,http://arxiv.org/pdf/1411.3146v1,12/11/2014 11:26,cs.CL,1858,2014
transducers from rewrite rules with backreferences,http://arxiv.org/pdf/cs/9904008v1,15/04/1999 15:00,cs.CL,1900,1999
reduction of intermediate alphabets in finite-state transducer cascades,http://arxiv.org/pdf/cs/0010030v1,23/10/2000 16:14,cs.CL,1901,2000
generating a 3d simulation of a car accident from a written description in natural language: the carsim system,http://arxiv.org/pdf/cs/0105023v1,14/05/2001 10:05,cs.CL,1902,2001
a geometric method to obtain the generation probability of a sentence,http://arxiv.org/pdf/1406.1234v1,05/06/2014 00:28,cs.CL,1904,2014
atlas: a flexible and extensible architecture for linguistic annotation,http://arxiv.org/pdf/cs/0007022v1,13/07/2000 19:26,cs.CL,1947,2000
integration of agile ontology mapping towards nlp search in i-soas,http://arxiv.org/pdf/1011.3258v1,14/11/2010 21:57,cs.CL,1949,2010
quantum-like uncertain conditionals for text analysis,http://arxiv.org/pdf/1106.0411v1,02/06/2011 13:14,cs.CL,1950,2011
a survey on phrase structure learning methods for text classification,http://arxiv.org/pdf/1406.5598v1,21/06/2014 12:30,cs.CL,1951,2014
do multi-sense embeddings improve natural language understanding?,http://arxiv.org/pdf/1506.01070v3,02/06/2015 22:30,cs.CL,1952,2015
similarity-based models of word cooccurrence probabilities,http://arxiv.org/pdf/cs/9809110v1,27/09/1998 19:42,cs.CL,2035,1998
part of speech tagging in thai language using support vector machine,http://arxiv.org/pdf/cs/0112004v1,05/12/2001 05:48,cs.CL,2071,2001
nlp and call: integration is working,http://arxiv.org/pdf/1302.4814v1,20/02/2013 05:47,cs.CL,2073,2013
system and methods for converting speech to sql,http://arxiv.org/pdf/1308.3106v1,14/08/2013 13:54,cs.CL,2074,2013
using robust pca to estimate regional characteristics of language use from geo-tagged twitter messages,http://arxiv.org/pdf/1311.1169v1,05/11/2013 19:31,cs.CL,2075,2013
a survey of named entity recognition in assamese and other indian languages,http://arxiv.org/pdf/1407.2918v1,09/07/2014 14:59,cs.CL,2076,2014
a hybrid model for enhancing lexical statistical machine translation (smt),http://arxiv.org/pdf/1506.01171v1,03/06/2015 10:18,cs.CL,2077,2015
a chart-parsing algorithm for efficient semantic analysis,http://arxiv.org/pdf/cs/0209002v1,02/09/2002 17:55,cs.CL,2266,2002
identifying bengali multiword expressions using semantic clustering,http://arxiv.org/pdf/1401.6122v1,23/01/2014 19:03,cs.CL,2267,2014
turning speech into scripts,http://arxiv.org/pdf/cs/0006017v1,09/06/2000 18:28,cs.CL,2289,2000
multidimensional transformation-based learning,http://arxiv.org/pdf/cs/0107021v1,17/07/2001 16:43,cs.CL,2290,2001
coaxing confidences from an old friend: probabilistic classifications from transformation rule lists,http://arxiv.org/pdf/cs/0104020v1,28/04/2001 00:16,cs.CL,2340,2001
transformation-based learning in the fast lane,http://arxiv.org/pdf/cs/0107020v1,17/07/2001 16:26,cs.CL,2341,2001
a method for open-vocabulary speech-driven text retrieval,http://arxiv.org/pdf/cs/0206014v1,09/06/2002 11:07,cs.CL,2342,2002
summarizing reports on evolving events; part i: linear evolution,http://arxiv.org/pdf/cs/0508092v1,22/08/2005 13:56,cs.CL,2343,2005
graph algorithms for improving type-logical proof search,http://arxiv.org/pdf/0805.2303v1,15/05/2008 14:30,cs.CL,2344,2008
experimental support for a categorical compositional distributional model of meaning,http://arxiv.org/pdf/1106.4058v1,21/06/2011 00:23,cs.CL,2345,2011
question answering in a natural language understanding system based on object-oriented semantics,http://arxiv.org/pdf/1111.4343v1,18/11/2011 12:31,cs.CL,2346,2011
recent technological advances in natural language processing and artificial intelligence,http://arxiv.org/pdf/1208.4079v1,20/08/2012 19:34,cs.CL,2347,2012
authorship recognition via fluctuation analysis of network topology and word intermittency,http://arxiv.org/pdf/1502.01245v1,04/02/2015 16:12,cs.CL,2349,2015
editorial for the first workshop on mining scientific papers: computational linguistics and bibliometrics,http://arxiv.org/pdf/1506.05402v1,17/06/2015 19:03,cs.CL,2350,2015
aspect-based opinion extraction from customer reviews,http://arxiv.org/pdf/1404.1982v1,08/04/2014 02:19,cs.CL,2369,2014
unsupervised cross-domain word representation learning,http://arxiv.org/pdf/1505.07184v1,27/05/2015 05:02,cs.CL,2375,2015
ellogon: a new text engineering platform,http://arxiv.org/pdf/cs/0205017v1,13/05/2002 12:18,cs.CL,2517,2002
nlomj--natural language object model in java,http://arxiv.org/pdf/cs/0404041v2,21/04/2004 07:30,cs.CL,2614,2004
towards structural natural language formalization: mapping discourse to controlled natural language,http://arxiv.org/pdf/1312.2087v1,07/12/2013 11:19,cs.CL,2616,2013
weighted automata in text and speech processing,http://arxiv.org/pdf/cs/0503077v1,29/03/2005 05:59,cs.CL,2673,2005
lexical normalisation of twitter data,http://arxiv.org/pdf/1409.4614v4,16/09/2014 13:59,cs.CL,2674,2014
splitting compounds by semantic analogy,http://arxiv.org/pdf/1509.04473v1,15/09/2015 11:03,cs.CL,2675,2015
sense2vec - a fast and accurate method for word sense disambiguation in neural word embeddings,http://arxiv.org/pdf/1511.06388v1,19/11/2015 21:22,cs.CL,2676,2015
detecting sub-topic correspondence through bipartite term clustering,http://arxiv.org/pdf/cs/9908001v1,01/08/1999 15:02,cs.CL,2751,1999
comparing two trainable grammatical relations finders,http://arxiv.org/pdf/cs/0008004v1,08/08/2000 23:42,cs.CL,2753,2000
more accurate tests for the statistical significance of result differences,http://arxiv.org/pdf/cs/0008005v1,09/08/2000 00:52,cs.CL,2754,2000
anaphora resolution in japanese sentences using surface expressions and examples,http://arxiv.org/pdf/cs/0009011v1,19/09/2000 01:44,cs.CL,2755,2000
using existing systems to supplement small amounts of annotated grammatical relations training data,http://arxiv.org/pdf/cs/0010020v1,11/10/2000 23:30,cs.CL,2757,2000
computational properties of environment-based disambiguation,http://arxiv.org/pdf/cs/0106011v1,07/06/2001 16:47,cs.CL,2758,2001
stacking classifiers for anti-spam filtering of e-mail,http://arxiv.org/pdf/cs/0106040v1,19/06/2001 15:56,cs.CL,2759,2001
integrating multiple knowledge sources for robust semantic parsing,http://arxiv.org/pdf/cs/0109023v1,17/09/2001 15:41,cs.CL,2760,2001
part-of-speech tagging with minimal lexicalization,http://arxiv.org/pdf/cs/0312060v1,27/12/2003 21:21,cs.CL,2761,2003
adapting a general parser to a sublanguage,http://arxiv.org/pdf/cs/0606118v1,28/06/2006 15:43,cs.CL,2762,2006
scaling construction grammar up to production systems: the scim,http://arxiv.org/pdf/cs/0611069v1,15/11/2006 12:35,cs.CL,2763,2006
ludics and its applications to natural language semantics,http://arxiv.org/pdf/0910.1484v1,08/10/2009 13:21,cs.CL,2764,2009
les entits nommes : usage et degrs de prcision et de dsambigusation,http://arxiv.org/pdf/1003.4149v1,22/03/2010 13:09,cs.CL,2765,2010
construction du lexique lglex  partir des tables du lexique-grammaire des verbes du grec moderne,http://arxiv.org/pdf/1111.3153v1,14/11/2011 09:34,cs.CL,2767,2011
frame interpretation and validation in a open domain dialogue system,http://arxiv.org/pdf/1207.4307v1,18/07/2012 10:09,cs.CL,2769,2012
cutting recursive autoencoder trees,http://arxiv.org/pdf/1301.2811v3,13/01/2013 19:33,cs.CL,2770,2013
a quantum teleportation inspired algorithm produces sentence meaning from word meaning and grammatical structure,http://arxiv.org/pdf/1305.0556v2,02/05/2013 19:49,cs.CL,2771,2013
ldc arabic treebanks and associated corpora: data divisions manual,http://arxiv.org/pdf/1309.5652v1,22/09/2013 22:09,cs.CL,2772,2013
robustly leveraging prior knowledge in text classification,http://arxiv.org/pdf/1503.00841v1,03/03/2015 06:59,cs.CL,2773,2015
content translation: computer-assisted translation tool for wikipedia articles,http://arxiv.org/pdf/1506.01914v1,05/06/2015 14:48,cs.CL,2775,2015
learning meta-embeddings by using ensembles of embedding sets,http://arxiv.org/pdf/1508.04257v2,18/08/2015 10:29,cs.CL,2776,2015
a framework for comparing groups of documents,http://arxiv.org/pdf/1508.05902v1,24/08/2015 19:14,cs.CL,2777,2015
better document-level sentiment analysis from rst discourse parsing,http://arxiv.org/pdf/1509.01599v2,04/09/2015 21:28,cs.CL,2778,2015
improving distant supervision using inference learning,http://arxiv.org/pdf/1509.03739v1,12/09/2015 13:59,cs.CL,2779,2015
building memory with concept learning capabilities from large-scale knowledge base,http://arxiv.org/pdf/1512.01173v1,03/12/2015 17:52,cs.CL,2780,2015
deep learning embeddings for discontinuous linguistic units,http://arxiv.org/pdf/1312.5129v2,18/12/2013 13:34,cs.CL,2839,2013
can prosody aid the automatic classification of dialog acts in conversational speech?,http://arxiv.org/pdf/cs/0006024v1,11/06/2000 07:00,cs.CL,2975,2000
category-theoretic quantitative compositional distributional models of natural language semantics,http://arxiv.org/pdf/1311.1539v1,06/11/2013 22:06,cs.CL,2976,2013
mostly-unsupervised statistical segmentation of japanese kanji sequences,http://arxiv.org/pdf/cs/0205009v1,10/05/2002 19:55,cs.CL,3041,2002
exploiting diversity for natural language parsing,http://arxiv.org/pdf/cs/0006012v1,05/06/2000 22:33,cs.CL,3082,2000
the application of fuzzy logic to collocation extraction,http://arxiv.org/pdf/0811.1260v1,08/11/2008 10:44,cs.CL,3083,2008
adversarial evaluation for models of natural language,http://arxiv.org/pdf/1207.0245v2,01/07/2012 22:13,cs.CL,3084,2012
natural language inference for arabic using extended tree edit distance with subtrees,http://arxiv.org/pdf/1402.0578v1,04/02/2014 01:40,cs.CL,3085,2014
on timeml-compliant temporal expression extraction in turkish,http://arxiv.org/pdf/1509.00963v1,03/09/2015 08:23,cs.CL,3086,2015
a graph traversal based approach to answer non-aggregation questions over dbpedia,http://arxiv.org/pdf/1510.04780v2,16/10/2015 06:35,cs.CL,3124,2015
towards effective sentence simplification for automatic processing of biomedical text,http://arxiv.org/pdf/1001.4277v1,24/01/2010 20:35,cs.CL,3205,2010
evaluation of the nlp components of the ovis2 spoken dialogue system,http://arxiv.org/pdf/cs/9906014v1,14/06/1999 11:06,cs.CL,3278,1999
the generation of textual entailment with nlml in an intelligent dialogue system for language learning csiec,http://arxiv.org/pdf/0802.4326v1,29/02/2008 06:16,cs.CL,3279,2008
sentence simplification aids protein-protein interaction extraction,http://arxiv.org/pdf/1001.4273v1,24/01/2010 20:23,cs.CL,3280,2010
rule based part of speech tagger for homoeopathy clinical realm,http://arxiv.org/pdf/1111.5293v1,13/11/2011 18:19,cs.CL,3281,2011
a complex network approach to stylometry,http://arxiv.org/pdf/1506.09107v2,30/06/2015 15:32,cs.CL,3282,2015
a planning based framework for essay generation,http://arxiv.org/pdf/1512.05919v2,18/12/2015 12:10,cs.CL,3283,2015
"semantic types, lexical sorts and classifiers",http://arxiv.org/pdf/1312.3168v1,11/12/2013 14:04,cs.CL,3317,2013
specifying logic programs in controlled natural language,http://arxiv.org/pdf/cmp-lg/9507009v1,21/07/1995 18:44,cmp-lg,17,1995
chart-driven connectionist categorial parsing of spoken korean,http://arxiv.org/pdf/cmp-lg/9511005v1,29/11/1995 05:19,cmp-lg,53,1995
skope: a connectionist/symbolic architecture of spoken korean processing,http://arxiv.org/pdf/cmp-lg/9504008v2,07/04/1995 15:39,cmp-lg,56,1995
constraint logic programming for natural language processing,http://arxiv.org/pdf/cmp-lg/9504005v1,05/04/1995 15:16,cmp-lg,75,1995
message-passing protocols for real-world parsing -- an object-oriented model and its preliminary evaluation,http://arxiv.org/pdf/cmp-lg/9709010v1,23/09/1997 13:43,cmp-lg,111,1997
"natural language processing: she needs something old and something new (maybe something borrowed and something blue, too)",http://arxiv.org/pdf/cmp-lg/9512004v1,21/12/1995 16:38,cmp-lg,120,1995
what is word sense disambiguation good for?,http://arxiv.org/pdf/cmp-lg/9712008v1,23/12/1997 15:32,cmp-lg,121,1997
integrated speech and morphological processing in a connectionist continuous speech understanding for korean,http://arxiv.org/pdf/cmp-lg/9603005v1,18/03/1996 06:59,cmp-lg,158,1996
natural language processing: structure and complexity,http://arxiv.org/pdf/cmp-lg/9607017v1,13/07/1996 22:31,cmp-lg,200,1996
a fast partial parse of natural language sentences using a connectionist method,http://arxiv.org/pdf/cmp-lg/9503023v1,22/03/1995 11:29,cmp-lg,208,1995
the role of the gricean maxims in the generation of referring expressions,http://arxiv.org/pdf/cmp-lg/9604006v1,18/04/1996 10:16,cmp-lg,209,1996
applying explanation-based learning to control and speeding-up natural language generation,http://arxiv.org/pdf/cmp-lg/9712001v1,08/12/1997 09:51,cmp-lg,210,1997
the theoretical status of ontologies in natural language processing,http://arxiv.org/pdf/cmp-lg/9704010v1,25/04/1997 14:00,cmp-lg,233,1997
graph interpolation grammars: a rule-based approach to the incremental parsing of natural languages,http://arxiv.org/pdf/cmp-lg/9804001v1,02/04/1998 15:47,cmp-lg,234,1998
methods and tools for building the catalan wordnet,http://arxiv.org/pdf/cmp-lg/9806009v1,11/06/1998 12:05,cmp-lg,249,1998
"a note on zipf's law, natural languages, and noncoding dna regions",http://arxiv.org/pdf/cmp-lg/9503012v1,09/03/1995 20:08,cmp-lg,286,1995
design and implementation of a computational lexicon for turkish,http://arxiv.org/pdf/cmp-lg/9702012v1,19/02/1997 16:36,cmp-lg,308,1997
robust processing of natural language,http://arxiv.org/pdf/cmp-lg/9507003v2,13/07/1995 16:41,cmp-lg,331,1995
memoization in constraint logic programming,http://arxiv.org/pdf/cmp-lg/9404005v1,11/04/1994 18:22,cmp-lg,364,1994
assigning grammatical relations with a back-off model,http://arxiv.org/pdf/cmp-lg/9706001v1,04/06/1997 17:58,cmp-lg,365,1997
lexicalization and grammar development,http://arxiv.org/pdf/cmp-lg/9410015v1,21/10/1994 16:08,cmp-lg,398,1994
measuring semantic complexity,http://arxiv.org/pdf/cmp-lg/9505019v1,08/05/1995 19:27,cmp-lg,399,1995
instructions for temporal annotation of scheduling dialogs,http://arxiv.org/pdf/cmp-lg/9702016v1,27/02/1997 20:16,cmp-lg,400,1997
attempto - from specifications in controlled natural language towards executable specifications,http://arxiv.org/pdf/cmp-lg/9603004v1,12/03/1996 08:36,cmp-lg,421,1996
software infrastructure for natural language processing,http://arxiv.org/pdf/cmp-lg/9702005v1,10/02/1997 21:07,cmp-lg,471,1997
fast statistical parsing of noun phrases for document indexing,http://arxiv.org/pdf/cmp-lg/9702009v1,12/02/1997 16:30,cmp-lg,478,1997
memory-based lexical acquisition and processing,http://arxiv.org/pdf/cmp-lg/9405018v1,16/05/1994 15:03,cmp-lg,536,1994
fastus: a cascaded finite-state transducer for extracting information from natural-language text,http://arxiv.org/pdf/cmp-lg/9705013v1,20/05/1997 21:58,cmp-lg,552,1997
"using single layer networks for discrete, sequential data: an example from natural language processing",http://arxiv.org/pdf/cmp-lg/9709012v1,23/09/1997 15:01,cmp-lg,600,1997
natural language dialogue service for appointment scheduling agents,http://arxiv.org/pdf/cmp-lg/9702007v1,11/02/1997 18:59,cmp-lg,607,1997
clare: a contextual reasoning and cooperative response framework for the core language engine,http://arxiv.org/pdf/cmp-lg/9411002v1,01/11/1994 15:36,cmp-lg,644,1994
abstract machine for typed feature structures,http://arxiv.org/pdf/cmp-lg/9504009v1,13/04/1995 06:36,cmp-lg,645,1995
automatic processing proper names in texts,http://arxiv.org/pdf/cmp-lg/9504001v2,03/04/1995 13:58,cmp-lg,701,1995
an information extraction core system for real world german text processing,http://arxiv.org/pdf/cmp-lg/9706023v1,18/06/1997 08:51,cmp-lg,702,1997
off-line optimization for earley-style hpsg processing,http://arxiv.org/pdf/cmp-lg/9502005v1,07/02/1995 11:22,cmp-lg,704,1995
a semantics-based communication system for dysphasic subjects,http://arxiv.org/pdf/cmp-lg/9703003v1,12/03/1997 08:42,cmp-lg,747,1997
morphological cues for lexical semantics,http://arxiv.org/pdf/cmp-lg/9606003v1,04/06/1996 10:17,cmp-lg,831,1996
an empirical evaluation of probabilistic lexicalized tree insertion grammars,http://arxiv.org/pdf/cmp-lg/9808001v1,04/08/1998 03:15,cmp-lg,832,1998
a grammar formalism and cross-serial dependencies,http://arxiv.org/pdf/cmp-lg/9507012v1,24/07/1995 12:25,cmp-lg,838,1995
gemini: a natural language system for spoken-language understanding,http://arxiv.org/pdf/cmp-lg/9407007v1,05/07/1994 23:25,cmp-lg,904,1994
fishing for exactness,http://arxiv.org/pdf/cmp-lg/9608010v1,16/08/1996 21:24,cmp-lg,928,1996
